created,original_post,title,url,8CAT,7CAT,5CAT,4CAT,org data,,,
2015,hit issu connect vpn server san jose problem occur postur assess procedur issu wire connect vpn success public direct internet connect use proxi postur assess fail access internet via proxi connect sjc vpn server address seem certif issu sure asnapshotfrom anyconnect client err2jpg final error messag popup err1jpg port oflibcsd log caus failur ?? ?? 15 100630780 20 libcsd debug hsverifyproxi set h peer http 1717019280 ?? ?? 15 100630780 20 libcsd debug hstransportwinhttpsetproxyautoi set proxi use ie proxi valu ?? ?? 15 100630788 20 libcsd debug hsverifyproxi verifi proxi ?? ?? 15 100630788 20 libcsd debug hstransportprob send probe request ?? ?? 15 100630906 20 libcsd debug hstransportwinhttpverifycerthashcheck use sha1 hash algorithm ?? ?? 15 100630907 20 libcsd error hstransportwinhttpverifycerthashcheck internetqueryopt 12019 ?? ?? 15 100630908 20 libcsd error hstransportwinhttpverifycerthashcheck winhttpqueryopt 12019 ?? ?? 15 100630908 20 libcsd debug hstransportwinhttpprob verifi cert hash fail ?? ?? 15 100630908 20 libcsd debug hstransportprob send probe request fail ?? ?? 15 100630908 20 libcsd debug hsverifyproxi verifi proxi fail attach full version libcsdlog pleas help thank,anyconnect: Hostscan CSD prelogin verification failed,https://supportforums.cisco.com/discussion/12508981/anyconnect-hostscan-csd-prelogin-verification-failed,4,4,4,4,x,,,
2015,success upgrad 931 941 test asax vpn box anyconnect 3105182 client still connect flawlessli oper system xp win7 mac butwindow surfac pro3 window 81 client get untrust vpn server block chang set allow access untrust still allow connect web browser workstat still abl get ssl vpn web page cert chain valid error anyconnect client seem issu certif anyon similar issu open tac case thank,"ASA-x IOS 9.4.1- Anyconnect- Windows 8.1 ""Untrusted VPN Server Blocked""",https://supportforums.cisco.com/discussion/12524736/asa-x-ios-941-anyconnect-windows-81-untrusted-vpn-server-blocked,4,4,4,4,x,,,
2015,guy configur site site vpn use easi vpn configur between two asa run ver 95 1 tunnel up ping reach between site also configur split tunnel internet traffic globalpolici easi vpn server asa unknown reason client even internet traffic forward main site configur nat exempt server side client side pleas advis limit setup thank regard arjun p easi vpn sitetosit,Easy VPN between two ASA 9.5- Split tunnel not working,https://supportforums.cisco.com/discussion/12590506/easy-vpn-between-two-asa-95-split-tunnel-not-working,4,4,4,4,x,,,
2015,sitetosit vpn between asa v916 code remot asa also sourcedestin nat see interest traffic initi remot side result in ipsec sa near end correspond sa match spi howev remot end sa show packet encrypt none decrypt near end asa show packet decryptedencrypt lose packet in vpn tunnel end match sasspi best regard richard,ASA to ASA VPN-encrypted packets 'getting lost' in tunnel,https://supportforums.cisco.com/discussion/12609681/asa-asa-vpn-encrypted-packets-getting-lost-tunnel,4,4,4,4,x,,,
2015,day 1 new world prepar ccna thought home lab would good idea got stuck first ever session got catalyst 3550 connect via usbseri cabl 2 day got get connect comm port howev start switch securecrt open nt anyth blank screen could find proper help onlin may new network world search problem use wrong keyword final thought jump forum in search answer problem anyon pleas help much appreci day 2 hour wait tri thing thought tri comm port work okay use window command prompt echo com1 per devic manag in use return error messag mean work okay echo com3 per devic manag in use usb serial adapt return error messag mean work okay howev tri putti securecrt tera term catalyst 3550 load anyth in screen blank screen cursor blink anyon pleas help catalyst 3550 blank screen catalyst 3550 securecrt,"Catalyst 3550, SecureCRT > COM3 Connected > Blank Screen",https://supportforums.cisco.com/discussion/12627106/catalyst-3550-securecrt-com3-connected-blank-screen,4,4,4,4,x,,,
2015,loss connect via vpn ping insid ip 19216812 outsid ip 4222 vpn remot client surf www insid network user www access network fine new ver 83 revis nt see miss info asaa sh xl 4 in use 12 use flag dn e extend ident dynam r portmap static twice n nettonet nat inside1921681024 outside24180xx24 flag idl 01046 timeout 00000 nat outside1921682024 outside24180x24 flag idl 00059 timeout 00000 nat inside1921681024 any1921681024 flag sit idl 01151 timeout 00000 nat any1921682024 inside1921682024 flag sit idl 01151 timeout 00000 asaa asaa sh nat manual nat polici section 1 1 insid sourc static insidenet insidenet destin static vpnnet vpnnet translatehit 3 untranslatehit 3 auto nat polici section 2 1 insid outsid sourc static insidenet 24180xx translatehit 3 untranslatehit 184 2 outsid outsid sourc static vpnnet 24180xx translatehit 97 untranslatehit 91 asaa sho log asa5305013 asymmetr nat rule match forward revers flow connect udp src outside192168210137 localus dst outside1921682255137 deni due nat revers path failur asa7609002 teardown localhost outside1921682255 durat 00000 asa7609001 built localhost outside1921682255 asa5305013 asymmetr nat rule match forward revers flow connect udp src outside192168210137 localus dst outside1921682255137 deni due nat revers path failur asa7609002 teardown localhost outside1921682255 durat 00000 current config asa version 90 1 hostnam asaa domainnam aloc enabl password xxxxx encrypt passwd xxxxx encrypt name ip local pool vpnpool 192168210192168220 interfac ethernet00 descript inet connect switchport access vlan 2 interfac ethernet01 descript lan connect switchport access vlan 3 interfac ethernet02 switchport access vlan 3 interfac ethernet03 switchport access vlan 3 interfac ethernet04 switchport access vlan 3 interfac ethernet05 switchport access vlan 3 interfac ethernet06 switchport access vlan 3 interfac ethernet07 switchport access vlan 3 interfac vlan1 nameif securitylevel ip address interfac vlan2 nameif outsid securitylevel 0 ip address 24180xx 255255255248 interfac vlan3 nameif insid securitylevel 100 ip address 19216811 2552552550 banner exec banner exec banner exec asaa banner exec banner exec asa5505 banner exec banner exec servic inc banner exec xxx n street drive banner exec citi st banner exec banner exec banner exec ftp mode passiv dn servergroup defaultdn domainnam aloc samesecuritytraff permit intrainterfac object network objani subnet 0000 0000 object network insidenet subnet 19216810 2552552550 object network vpnnet subnet 19216820 2552552550 accesslist nonat extend permit ip 19216820 2552552550 19216810 2552552550 accesslist inbound extend permit gre accesslist inbound extend permit udp host 24180xx eq 1723 accesslist inbound extend permit tcp host 24180xx eq pptp accesslist inbound extend permit tcp host 24180xx eq smtp accesslist inbound extend permit tcp host 24180xx eq www accesslist inbound extend permit tcp host 24180xx eq http accesslist inbound extend permit tcp host 24180xx eq 987 accesslist inbound extend permit udp host 24180xx eq 25 accesslist inbound extend permit udp host 24180xx eq 443 accesslist inbound extend permit udp host 24180xx eq www accesslist inbound extend permit udp host 24180xx eq 987 pager line 24 log enabl log buffer debug log asdm inform mtu outsid 1500 mtu insid 1500 icmp unreach ratelimit 1 burstsiz 1 icmp permit outsid icmp permit insid asdm histori enabl arp timeout 14400 arp permitnonconnect nat insid sourc static insidenet insidenet destin static vpnnet vpnnet object network insidenet nat insid outsid static 24180xx object network vpnnet nat outsid outsid static 24180xx accessgroup inbound in interfac outsid rout outsid 0000 0000 24180xx 1 timeout xlate 30000 timeout patxlat 00030 timeout conn 10000 halfclos 01000 udp 00200 icmp 00002 timeout sunrpc 01000 h323 00500 h225 10000 mgcp 00500 mgcppat 00500 timeout sip 03000 sipmedia 00200 sipinvit 00300 sipdisconnect 00200 timeout sipprovisionalmedia 00200 uauth 00500 absolut timeout tcpproxyreassembl 00100 timeout floatingconn 00000 dynamicaccesspolicyrecord dfltaccesspolici userident defaultdomain local http server enabl snmpserver locat snmpserver contact snmpserver enabl trap snmp authent linkup linkdown coldstart warmstart ipsec ikev1 transformset vpnremot esp3d espmd5hmac ipsec ikev2 ipsecpropos vpnremotetest protocol esp encrypt aes256 aes192 ae 3de de protocol esp integr sha1 ipsec securityassoci pmtuag infinit dynamicmap dyn1 1 set ikev1 transformset vpnremot dynamicmap dyn1 1 set reverserout map vpnmap 1 ipsecisakmp dynam dyn1 map vpnmap interfac outsid ca trustpointsmartcallhomeserverca crl configur ca trustpool polici ca certif chainsmartcallhomeserverca certif ca 6ecc7aa5a7032009b8cebcf4e952d491 308205ec 308204d4 a0030201 0202106e cc7aa5a7 032009b8 cebcf4e9 52d49130 0d06092a 864886f7 0d010105 05003081 ca310b30 09060355 04061302 55533117 30150603 55040a13 0e566572 69536967 6e2c2049 6e632e31 1f301d06 0355040b 13165665 72695369 676e2054 72757374 204e6574 776f726b 313a3038 06035504 0b133128 63292032 30303620 56657269 5369676e 2c20496e 632e202d 20466f72 20617574 686f7269 7a656420 75736520 6f6e6c79 31453043 06035504 03133c56 65726953 69676e20 436c6173 73203320 5075626c 69632050 72696d61 72792043 65727469 66696361 74696f6e 20417574 686f7269 7479202d 20473530 1e170d31 30303230 38303030 3030305a 170d3230 30323037 32333539 35395a30 81b5310b 30090603 55040613 02555331 17301506 0355040a 130e5665 72695369 676e2c20 496e632 311f301d 06035504 0b131656 65726953 69676e20 54727573 74204e65 74776f72 6b313b30 39060355 040b1332 5465726d 73206f66 20757365 20617420 68747470 733a2f2f 7777772e 76657269 7369676e 2e636f6d 2f727061 20286329 3130312f 302d0603 55040313 26566572 69536967 6e20436c 61737320 33205365 63757265 20536572 76657220 4341202d 20473330 82012230 0d06092a 864886f7 0d010101 05000382 010f0030 82010a02 82010100 b187841f c20c45f5 bcab2597 a7ada23 9cbaf6c1 39b88bca c2ac56c6 e5bb658 444f4dce 6fed094a d4af4e10 9c688b2e 957b899b 13cae234 34c1f35b f3497b62 83488174 d188786c 0253f9bc 7f432657 5833833b 330a17b0 d04e9124 ad867d64 12dc744a 34a11d0a ea961d0b 15fca34b 3bce6388 d0f82d0c 948610ca b69a3dca eb379c00 48358629 5078e845 63cd1941 4ff595ec 7b98d4c4 71b350be 28b38fa0 b9539cf5 ca2c23a9 fd1406e8 18b49ae8 3c6e81fd e4cd3536 b351d369 ec12ba56 6e6f9b57 c58b14e7 0ec79c 4a546ac9 4dc5bf11 b1ae1c67 81cb4455 33997f24 9b3f5345 7f861af3 3cfa6d7f 81f5b84a d3f58537 1cb5a6d0 09e4187b 384efa0f 02030100 01a38201 df308201 db303406 082b0601 05050701 01042830 26302406 082b0601 05050730 01861868 7474703a 2f2f6f63 73702e76 65726973 69676e2e 636f6d30 12060355 1d130101 ff040830 060101ff 02010030 70060355 1d200469 30673065 060b6086 480186f8 45010717 03305630 2806082b 06010505 07020116 1c687474 70733a2f 2f777777 2e766572 69736967 6e2e636f 6d2f6370 73302a06 082b0601 05050702 02301e1a 1c687474 70733a2f 2f777777 2e766572 69736967 6e2e636f 6d2f7270 61303406 03551d1f 042d302b 3029a027 a0258623 68747470 3a2f2f63 726c2e76 65726973 69676e2e 636f6d2f 70636133 2d67352e 63726c30 0e060355 1d0f0101 ff040403 02010630 6d06082b 06010505 07010c04 61305fa1 5da05b30 59305730 55160969 6d616765 2f676966 3021301f 30070605 2b0e0302 1a04148f e5d31a86 ac8d8e6b c3cf806a d448182c 7b192e30 25162368 7474703a 2f2f6c6f 676f2e76 65726973 69676e2e 636f6d2f 76736c6f 676f2e67 69663028 0603551d 11042130 1fa41d30 1b311930 17060355 04031310 56657269 5369676e 4d504b49 2d322d36 301d0603 551d0e04 1604140d 445c1653 44c1827e 1d20ab25 f40163d8 be79a530 1f060355 1d230418 30168014 7fd365a7 c2ddecbb f03009f3 4339fa02 af333133 300d0609 2a864886 f70d0101 05050003 82010100 0c8324ef ddc30cd9 589cfe36 b6eb8a80 4bd1a3f7 9df3cc53 ef829ea3 a1e697c1 589d756c e01d1b4c fad1c12d 05c0ea6 b2227055 d9203340 3307c265 83fa8f43 379bea0 9a6c70e f69c803b d937f47a 6decd018 7d494aca 99c71928 a2bed877 24f78526 866d8705 404167d1 273aeddc 481d22cd 0b0b8bbc f4b17bfd b499a8e9 762ae11a 2d876e74 d388dd1e 22c6df16 b62b8214 0a945cf2 50ecafc ff62370d ad65d306 4153ed02 14c8b558 28a1ace0 5becb37f 954afb03 c8ad26db e6667812 4ad99f42 fbe198e6 42839b8f 8f6724e8 6119b5dd cdb50b26 058ec36 c4c875b8 46cfe218 065ea9a a8819a47 16de0c28 6c2527b9 deb78458 c61f381e a4c4cb66 quit ikev1 enabl outsid ikev1 polici 1 authent preshar encrypt 3de hash sha group 2 lifetim 43200 telnet timeout 5 ssh timeout 5 consol timeout 0 dhcpd autoconfig outsid threatdetect basicthreat threatdetect statist accesslist threatdetect statist tcpintercept usernam unam password xxxxxxxxx encrypt privileg 15 tunnelgroup vpnremot type remoteaccess tunnelgroup vpnremot generalattribut addresspool vpnpool tunnelgroup vpnremot ipsecattribut ikev1 presharedkey classmap inspectiondefault match defaultinspectiontraff policymap type inspect dn presetdnsmap paramet messagelength maximum client auto messagelength maximum 512 policymap globalpolici class inspectiondefault inspect dn presetdnsmap inspect ftp inspect h323 h225 inspect h323 ra inspect rsh inspect rtsp inspect esmtp inspect sqlnet inspect skinni inspect sunrpc inspect xdmcp inspect sip inspect netbio inspect tftp inspect ipopt inspect icmp servicepolici globalpolici global prompt hostnam context callhom report anonym cryptochecksum43db9ab2d3427289fb9a0fdb22b551fa end,"ASA Version 9.0(1)- Ping works inside and outside, WWW is not working for remote VPNs",https://supportforums.cisco.com/discussion/12637716/asa-version-901-ping-works-inside-and-outside-www-not-working-remote-vpns,4,4,4,4,x,,,
2015,hope someon may abl help realli annoy problem recent installedanyconnect vpn amacbook air 13inch mid 2011 machin 4 user account vpn visibl in applic menu one account cours one actual need vpn function softwar appear instal function start program open connect window menu command surround percent sign see attach problem screen cap 1 inact account vpn fulli function see attach problem screen cap 2 connect window open expect abl connect remot resourc requir vpn institut true whether anyconnect vpn instal within problem account anoth account given singl account problem think accountspecif set secur abl identifi differ in secur set anyon seen problem anyconnect specif know issu know sign in menu might indic sourc problem thank in advanc help advic,User account specific problem with AnyConnect VPN on Mac OS X Yosemite 10.10,https://supportforums.cisco.com/discussion/12708956/user-account-specific-problem-anyconnect-vpn-mac-os-x-yosemite-1010,4,4,4,4,x,,,
2015,user log vpn asa look cac common name instead ldap samaccountnam authent caus error within log in script user log vpn issu two part problem certif chain issu ldapseem look common name instead look ldap nameon ad,sAMAccount issues,https://supportforums.cisco.com/discussion/12732341/samaccount-issues,4,4,4,4,x,,,
2015,dear struggl understand debug output asa vpn configur remot checkpoint in short problem within p1 p2 rekey timer defin timer 28800 8 hour match up timer sinc checkpoint firewal automat delet p2 sa p1 rekey asa howev remain send packet use exist p2 sa remain lifetim run out said ipsec tunnel go down everi 6 hour strang sinc timer set 8 hour grab debug output asa found two messag within output succes tunnel come up 20151222 132617 local5 debug asahostnam asa7715080 group remotep ip remotep start p1 rekey timer 21600 second 20151222 132617 local5 debug asahostnam asa7715080 group remotep ip remotep start p2 rekey timer 24480 second indic rekey take place actual defin timer run out possibl run show ikev1 sa detail show ipsec sa peer valid timer 28800 second clear tunnel remain lifetim also match up p1 p2 show valu higher one set in debug output wonder timer valu differ in debug log opposit actual configur valu valu produc show command hope somebodi shed light hessel asa checkpoint s2 ipsec ike sa securityassoci lifetim second kilobyt sitetosit vpn,ASA &lt;> Checkpoint S2S VPN troubles,https://supportforums.cisco.com/discussion/12734506/asa-checkpoint-s2s-vpn-troubles,4,4,4,4,x,,,
2016,run asa 5525x os 94 1 asdm 75 1 use clientless webvpn portal page access select system 94 1 version notic yellow triangl exclam point flash homepag portal page notic function limit becom nuisanc end user gener continu support call think someth wrong anyon tell mean elimin thank,Cisco ASA 5525-X Clientless VPN WEBVPN Portal Page Issue,https://supportforums.cisco.com/discussion/12742666/cisco-asa-5525-x-clientless-vpn-webvpn-portal-page-issue,4,4,4,4,x,,,
2016,good morn configur vpn anyconnect ipsec asa firewal download profil neither connect secur gateway upload profil manual pc path c user user appdatalocalciscocisco anyconnect secur mobil client previous alreadi anyconnect instal anoth secur gateway everyth work correctli toward gateway moment tri instal anyconnect new secur gateway uninstal first older connect anymor old secur gateway obtain error new version anyconnect instal anyconnectwin3101065k9pkg anyconnect mobil connect without problem suggest thank support anyway luigi celest asa vpn anyconnect error cstp,"Cisco AnyConnect ""CSTP Not Enabled""",https://supportforums.cisco.com/discussion/12746861/cisco-anyconnect-cstp-not-enabled,4,4,4,4,x,,,
2016,goal use one url prompt select domain login creat alia in connect profil creat connect profil authent new ldap server in server group test ldap authent asdm get authent reject unspecifi cli debug ldap 255 output 2147483574 session start 2147483574 new request session context 0x00007ffe60a2d7c8 reqtyp authent 2147483574 fiber start 2147483574 creat ldap context urildap 19216844200389 2147483574 connect ldap server ldap 19216844200389 statu success 2147483574 supportedldapvers valu 3 2147483574 supportedldapvers valu 2 2147483574 bind vpnaccount 2147483574 perform simpl authent vpnaccount 19216844200 2147483574 ldap search base dn dcnewdom dcco dcuk filter vpnaccount720310 scope subtre 2147483574 search result pars return failur statu 2147483574 fiber exit tx280 byte rx844 byte status1 2147483574 session end know cant tell problem info anyon point look would appreci,configuring an alias,https://supportforums.cisco.com/discussion/12765721/configuring-alias,4,4,4,4,x,,,
2016,new firewal tri get anyconnect test setup connect address in local lan anyconnect client connect easili get internet address packet tracer tell drop phase 6 webvpnsvc someon valid config sure miss someth fairli obviou config past interfac ethernet00 descript lt uplink isp switchport access vlan 20 interfac ethernet01 descript lt insid switchport access vlan 10 speed 100 duplex full interfac ethernet02 descript lt home switch switchport access vlan 10 interfac ethernet03 switchport access vlan 10 interfac ethernet04 interfac ethernet05 shutdown interfac ethernet06 shutdown interfac ethernet07 shutdown interfac vlan10 nameif insid securitylevel 100 ip address 192168199 2552552550 interfac vlan20 nameif outsid securitylevel 0 dhcp client updat dn ip address dhcp setrout interfac vlan30 nameif securitylevel ip address banner motd banner motd banner motd banner motd unauthor use access prohibit banner motd banner motd author offici use banner motd must explicit permiss access banner motd configur devic activ perform banner motd devic may log violat banner motd polici may result in disciplinari action banner motd may report law enforc author banner motd banner motd right privaci devic banner motd banner motd banner motd boot system disk0 asa824k8 ftp mode passiv clock timezon cst6 clock summertim cdt recur samesecuritytraff permit intrainterfac objectgroup icmptyp defaulticmp descript lt default icmp type permit icmpobject echorepli icmpobject unreach icmpobject timeexceed objectgroup network objanyconnect networkobject host 192168720 networkobject host 192168721 networkobject host 192168722 networkobject host 192168723 networkobject host 192168724 networkobject host 192168725 accesslist 101 extend permit icmp accesslist acloutsid remark lt lt lt anyconnect permit accesslist acloutsid extend permit tcp eq http accesslist acloutsid extend permit icmp objectgroup defaulticmp accesslist vpnnat extend permit ip host 192168720 accesslist vpnnat extend permit ip host 192168721 accesslist vpnnat extend permit ip host 192168722 accesslist vpnnat extend permit ip host 192168723 accesslist vpnnat extend permit ip host 192168724 accesslist vpnnat extend permit ip host 192168725 accesslist nonat extend permit ip objectgroup objanyconnect 19216810 2552552550 pager line 24 log enabl log timestamp log buffer inform log trap inform log asdm error mtu insid 1500 mtu outsid 1500 ip local pool anyconnectpool 192168720192168725 mask 2552552550 icmp unreach ratelimit 1 burstsiz 1 asdm imag disk0 asdm645bin asdm histori enabl arp timeout 14400 global outsid 1 interfac nat insid 1 19216810 2552552550 nat outsid 1 accesslist vpnnat accessgroup acloutsid in interfac outsid router rip network 19216810 passiveinterfac outsid version 2 timeout xlate 30000 timeout conn 10000 halfclos 01000 udp 00200 icmp 00002 timeout sunrpc 01000 h323 00500 h225 10000 mgcp 00500 mgcppat 00500 timeout sip 03000 sipmedia 00200 sipinvit 00300 sipdisconnect 00200 timeout sipprovisionalmedia 00200 uauth 00500 absolut timeout tcpproxyreassembl 00100 dynamicaccesspolicyrecord dfltaccesspolici aaa authent http consol local http server enabl http 19216810 2552552550 insid http 19216820 2552552550 insid snmpserver locat snmpserver contact snmpserver enabl trap snmp authent linkup linkdown coldstart sysopt connect tcpmss 1200 ipsec transformset esp3dessha esp3d espshahmac ipsec securityassoci lifetim second 28800 ipsec securityassoci lifetim kilobyt 4688000 dynamicmap dynmap 20 set transformset esp3dessha map outsidemap 64553 ipsecisakmp dynam dynmap map outsidemap interfac outsid isakmp ident hostnam isakmp enabl outsid isakmp polici 10 authent preshar encrypt 3de hash sha group 2 lifetim 86400 vpnaddrassign local reusedelay 120 ssh 19216810 2552552550 insid ssh 19216820 2552552550 insid ssh timeout 60 consol timeout 0 managementaccess insid dhcpclient broadcastflag dhcpd dn xxxx dhcpd leas 43200 dhcpd pingtimeout 2000 dhcpd autoconfig outsid dhcpd address 19216811501921681180 insid dhcpd enabl insid threatdetect basicthreat threatdetect statist accesslist threatdetect statist tcpintercept ntp server 2162290179 ssl encrypt 3dessha1 aes128sha1 aes256sha1 rc4sha1 ssl trustpoint localtrust outsid webvpn enabl outsid anyconnectessenti svc imag disk0 anyconnectwin4201035k9pkg 1 svc imag disk0 anyconnectlinux644201035k9pkg 2 svc imag disk0 anyconnectmacosxi3864201035k9pkg 3 svc enabl tunnelgrouplist enabl grouppolici dfltgrppolici attribut vpntunnelprotocol ipsec l2tpipsec svc webvpn grouppolici anyconnect intern grouppolici anyconnect attribut dnsserver valu xxxx vpntunnelprotocol svc addresspool valu anyconnectpool tunnelgroup remotevpn type remoteaccess tunnelgroup anyconnect type remoteaccess tunnelgroup anyconnect generalattribut defaultgrouppolici anyconnect tunnelgroup anyconnect webvpnattribut groupalia myra enabl classmap inspectiondefault match defaultinspectiontraff policymap type inspect dn presetdnsmap paramet messagelength maximum 512 policymap globalpolici class inspectiondefault inspect dn presetdnsmap inspect ftp inspect h323 h225 inspect h323 ra inspect rsh inspect rtsp inspect esmtp inspect sqlnet inspect skinni inspect sunrpc inspect xdmcp inspect sip inspect netbio inspect tftp inspect ipopt servicepolici globalpolici global prompt hostnam context autoupd pollperiod 30 3 1 autoupd timeout 1 callhom profil ciscotac1 activ destin address http http toolsciscocomitsserviceoddceservicesddceservic destin address email callhom ciscocom destin transportmethod http subscribetoalertgroup diagnost subscribetoalertgroup environ subscribetoalertgroup inventori period monthli subscribetoalertgroup configur period monthli subscribetoalertgroup telemetri period daili cryptochecksum d41d8cd98f00b204e9800998ecf8427 end,Can't reach inside LAN from Cisco Anyconnect,https://supportforums.cisco.com/discussion/12958061/cant-reach-inside-lan-cisco-anyconnect,4,4,4,4,x,,,
2016,upgrad asa5512x version 94 2 6 sinc upgrad one anyconnect vpn connect work anoth connect start kick first one out struggl initi connect asa 10 premium licens work 86 advic would appreci mani thank,ASA Webvpn anyconnect not working after upgrade to 9.42,https://supportforums.cisco.com/discussion/12958961/asa-webvpn-anyconnect-not-working-after-upgrade-942,4,4,4,4,x,,,
2015,tri set up getvpn router connect one interfac mpl backbon ldp provid router bgp site in mpl cloud interfac subinterfac map vrf interfac connect l3 switch vrf configur well in setup ping swich loopback router loopback within vrf everyth work enabl map sub interfac point switch ping fail get follow messag crypto4recvdpktnotipsec rec packet ipsec packet ip vrfdestaddr cust2101081252 srcaddr 1010815 prot 1 place map interfac face provid router also work vrf configur 1000000 question support setup andwher place map in order make setup work thank in advanc alex,GETVPN in CsC MPLS,https://supportforums.cisco.com/discussion/12406841/getvpn-csc-mpls,4,4,4,4,,,,
2015,custom bookmark intranet within clientless vpn portal remot user access intern intranet howev â€™ access drop down menu appear hover click drop down link â€¦ unsur asa client java issu work good use locali instal vpn client direct pc websit issu clientless portal asa 5510 asa version â€“ 82 5 cheer jame,SSL Clientless VPN Portal,https://supportforums.cisco.com/discussion/12408401/ssl-clientless-vpn-portal,4,4,4,4,,,,
