created,original_post,title,url,8CAT,7CAT,5CAT,4CAT,org data,,,
2016,issu anyconnect client connnect ca nt access anyth includ default gateway vpn client pool in subnet local network 139161x24 local network client access dmz vpn client ping local network comput ca nt access dmz guess rule alow traffic miss iÂ´m new asa iÂ´m total lost read much could ca nt understand rule need mani mani thank in advanc support asa version 94 1 hostnam ciscoasa enabl password wmlxhdtfanw9xbca encrypt passwd taqizy4rchqqh encrypt name ip local pool pool139 1391615013916180 mask 2552552550 interfac gigabitethernet11 nameif outsid securitylevel 0 ip address 1921681100 2552552550 interfac gigabitethernet12 nameif insid securitylevel 100 ip address 1391611 2552552550 interfac gigabitethernet13 nameif dmz securitylevel 50 ip address 1721611 2552552550 interfac gigabitethernet14 shutdown nameif securitylevel ip address interfac gigabitethernet15 shutdown nameif securitylevel ip address interfac gigabitethernet16 shutdown nameif securitylevel ip address interfac gigabitethernet17 shutdown nameif securitylevel ip address interfac gigabitethernet18 shutdown nameif securitylevel ip address interfac management11 managementonli nameif manag securitylevel 100 ip address 11111111 2552552550 ftp mode passiv object network objani subnet 0000 0000 object network insidesubnet subnet 1391610 2552552550 object network dmzsubnet subnet 1721610 2552552550 object network wialonserverexternalip host 1921681132 object network wialonserv host 17216169 object servic wialonservicestcp servic tcp sourc rang 1 65535 destin rang 20100 21999 object servic wialonservicesudp servic udp sourc rang 0 65535 destin rang 20100 21999 object network networkobj139161025 subnet 1391610 255255255128 accesslist outsideacl extend permit tcp object wialonserv eq www accesslist outsideacl extend permit object wialonservicestcp object wialonserv accesslist outsideacl extend permit object wialonservicesudp object wialonserv pager line 24 log asdm inform mtu outsid 1500 mtu insid 1500 mtu dmz 1500 mtu manag 1500 icmp unreach ratelimit 1 burstsiz 1 asdm histori enabl arp timeout 14400 arp permitnonconnect nat insid outsid sourc static destin static networkobj139161025 networkobj139161025 noproxyarp routelookup object network objani nat outsid dynam interfac object network insidesubnet nat insid outsid dynam interfac object network wialonserv nat dmz outsid static wialonserverexternalip servic tcp www www accessgroup outsideacl in interfac outsid rout outsid 0000 0000 19216811 1 timeout xlate 30000 timeout patxlat 00030 timeout conn 10000 halfclos 01000 udp 00200 icmp 00002 timeout sunrpc 01000 h323 00500 h225 10000 mgcp 00500 mgcppat 00500 timeout sip 03000 sipmedia 00200 sipinvit 00300 sipdisconnect 00200 timeout sipprovisionalmedia 00200 uauth 00500 absolut timeout tcpproxyreassembl 00100 timeout floatingconn 00000 userident defaultdomain local http server enabl http 1111110 2552552550 manag http 1391610 2552552550 insid snmpserver locat snmpserver contact servic swresetbutton ipsec ikev2 ipsecpropos aes256 protocol esp encrypt aes256 protocol esp integr sha1 md5 ipsec ikev2 ipsecpropos aes192 protocol esp encrypt aes192 protocol esp integr sha1 md5 ipsec ikev2 ipsecpropos ae protocol esp encrypt ae protocol esp integr sha1 md5 ipsec ikev2 ipsecpropos 3de protocol esp encrypt 3de protocol esp integr sha1 md5 ipsec ikev2 ipsecpropos de protocol esp encrypt de protocol esp integr sha1 md5 ipsec securityassoci pmtuag infinit dynamicmap systemdefaultcryptomap 65535 set ikev2 ipsecpropos aes256 aes192 ae 3de de map outsidemap 65535 ipsecisakmp dynam systemdefaultcryptomap map outsidemap interfac outsid ca trustpoint asdmtrustpoint0 enrol self fqdn ciscoasasrdongatonul email lunero gmailcom subjectnam cnsrdongato serialnumb proxyldcissu crl configur ca trustpoint asdmlauncheraccesstrustpoint0 enrol self fqdn none subjectnam cn1391611 cnciscoasa keypair asdmlaunch crl configur ca trustpool polici ca certif chain asdmtrustpoint0 certif 09836256 30820381 30820269 a0030201 02020409 83625630 0d06092a 864886f7 0d010105 05003050 31123010 06035504 03130973 72646f6e 6761746f 313a3012 06035504 05130b4a 41443139 32323033 34343024 06092a86 4886f70d 01090216 17636973 636f6173 612e7372 646f6e67 61746f2e 6e756c6c 301e170d 31353132 30353036 33333535 5a170d32 35313230 32303633 3335355a 30503112 30100603 55040313 09737264 6f6e6761 746f313a 30120603 55040513 0b4a4144 31393232 30333434 30240609 2a864886 f70d0109 02161763 6973636f 6173612e 7372646f 6e676174 6f2e6e75 6c6c3082 0122300d 06092a86 4886f70d 01010105 00038201 0f003082 010a0282 010100d2 295e679c 153e8b6a d3f6131d 8ea646e3 aa0a5fa9 20e49259 ca895563 7e818047 033a4e8f 57f619e9 fa93bfd5 6c44141f b0abf2c0 8b86334e bac63f41 99e6d676 c689dcf7 080f2715 038a8e1b 694a00d 7124565e a1948f09 8dbeffab c7c8a028 741c5b10 d0ede5e9 599f38fe 5b88f678 4decdc4b 353b6708 cfa2fbc f58be06 18feba56 4b2b04a1 77773ec6 5c58d2ed d7ca4f17 980f0353 138bfe65 1b1165e6 7b6f94bb ab4d4286 e900178c 147a6dba 2427f38e e225030f 0a66d1eb 5075c57e 6d77e5bb 247f5bc3 8d3530f0 49dedf2d 21a24b5f daa08d98 690183cf e82a6b8d 5e489956 c5eecdbc 7fc2365c b629a52b 126b51e2 18590ed5 c9da8503 a639f102 03010001 a3633061 300f0603 551d1301 01ff0405 30030101 ff300e06 03551d0f 0101ff04 04030201 86301f06 03551d23 04183016 80143468 dec79103 0a91b530 1ada7e47 7e27b16d 4186301d 0603551d 0e041604 143468de c791030a 91b5301a da7e477 27b16d41 86300d06 092a8648 86f70d01 01050500 03820101 003cdb04 8ef5ed31 c05c684b ad2b0062 96bfd39a ecb0a3f 547aebe5 14b753e7 89f55827 3d4e0aa8 b8674e45 80d4c023 8e99a7b4 0907d347 060a2fe4 fa6e0c2f 3b9cd708 a539c09f 7022d2ee fb6e2cf6 82b0e861 a2839a71 1512b3ec e28664e9 732270c9 d1c679d9 1eaf2ad5 007b5699 31c3ff97 09aae869 88677a3d ecb3032 2dd0f74f 81f9a8fb 79f30809 723bbdbf dfef4154 5ad6b012 a8f37093 481fa678 23390036 b44b0290 042828f3 5eefdc43 78934455 ebe52d26 9b4234a9 bfeebc43 731c4146 166e5adc b431f12f 8d0fbf16 46306228 34d76984 d2e6ebbc 96838694 88ca120a d4f32884 963e7385 987ec6b0 dfa28d49 05ba5fa8 641bcfc7 ff92ac3c 52 quit ca certif chain asdmlauncheraccesstrustpoint0 certif 0a836256 308202cc 308201b4 a0030201 0202040a 83625630 0d06092a 864886f7 0d010105 05003028 3111300f 06035504 03130863 6973636f 61736131 13301106 03550403 130a3133 392e3136 2e312e31 301e170d 31353132 30353036 35363236 5a170d32 35313230 32303635 3632365a 30283111 300f0603 55040313 08636973 636f6173 61311330 11060355 0403130a 3133392e 31362e31 2e313082 0122300d 06092a86 4886f70d 01010105 00038201 0f003082 010a0282 010100e7 a5c16e86 16c15a10 e018b868 bac7271a 30f1a3f8 ecb9c6b8 3ed4b1ad c9468f5e 287f2a7a 644f1496 c43a061 da927d09 a755b53 ed7c6a66 f2f1fb1e f944345c 86e08ce0 891c99b3 13101ab3 04963fad f91f987f 99f22a89 cd1e8c5a 5e4c026d 2cadd7b7 6620bbd1 b4a5135b 24ec886f fa061a06 dd536e96 1e483730 756c4101 23f83a8d 944a7fb 93c51d56 32ac0d17 ceb75f63 0ae24f07 f2c54e83 5b84ff00 16b0b899 c925c737 1765b066 23b54645 bc419684 d09dd130 c1479949 68b0a779 df39b078 6fb0deb9 758b14c3 f0801faf f0ad60e1 a018ffba d769f867 3fe8e5fc 88ccc5b2 2319f5d4 617a78c4 74e7a64b 5c68276c 06ea57c1 d0ffce4b 358c4d02 03010001 300d0609 2a864886 f70d0101 05050003 82010100 dff97c9f 4256fd47 8eb661fd d22ecea4 589eff09 958e01f1 a435a20 5ed1cf19 af42e54d d61fc0ab cb2ee7ac 7fcb4513 1a44cc86 1e020d72 3a3f78d2 4d225177 857093d9 f5fcf3c7 6e656d2b 54a0c522 f636b8cf 33c5ae34 ea340f32 85dff4c1 50165e7a e94de10b ced15752 0b3a76c1 20291106 2a50777b a1a8a214 8a003716 680c15d4 ac3f7cc7 378f8f5f 38e3403f f958c095 e549c8 4baf8cc5 bdcd230e 260754ea 953c3a4c eb01fef5 62b97e01 9f82ce6b f479dbdd 000c45af 8758b35f b4a958e 32c4db3f 2ddc7385 dc05b0e3 78b609ba a9280841 2433ae87 5dd7a7c2 d5691068 1dc0eddc c23f99c5 3df8b1a5 aadbd82a 423f4ba8 563142bf 742771c3 quit ikev2 polici 1 encrypt aes256 integr sha group 5 2 prf sha lifetim second 86400 ikev2 polici 10 encrypt aes192 integr sha group 5 2 prf sha lifetim second 86400 ikev2 polici 20 encrypt ae integr sha group 5 2 prf sha lifetim second 86400 ikev2 polici 30 encrypt 3de integr sha group 5 2 prf sha lifetim second 86400 ikev2 polici 40 encrypt de integr sha group 5 2 prf sha lifetim second 86400 ikev2 enabl outsid clientservic port 443 ikev2 remoteaccess trustpoint asdmtrustpoint0 telnet 1391610 2552552550 insid telnet 1111110 2552552550 manag telnet timeout 5 ssh stricthostkeycheck ssh timeout 5 ssh keyexchang group dhgroup1sha1 consol timeout 0 dhcpd autoconfig outsid dhcpd address 1721616917216169 dmz dhcpd dn 87216165 87216166 interfac dmz dhcpd option 3 ip 1721611 interfac dmz dhcpd enabl dmz threatdetect basicthreat threatdetect statist accesslist threatdetect statist tcpintercept ssl trustpoint asdmtrustpoint0 outsid ssl trustpoint asdmlauncheraccesstrustpoint0 insid ssl trustpoint asdmlauncheraccesstrustpoint0 insid vpnlbip webvpn enabl outsid anyconnect imag disk0 anyconnectwin3112020k9pkg 1 anyconnect profil wialonclientprofil disk0 wialonclientprofilexml anyconnect enabl tunnelgrouplist enabl errorrecoveri disabl grouppolici grouppolicywialon intern grouppolici grouppolicywialon attribut winsserv none dnsserver valu 19216811 vpntunnelprotocol ikev2 sslclient defaultdomain none webvpn anyconnect profil valu wialonclientprofil type user dynamicaccesspolicyrecord dfltaccesspolici usernam wialon1 password wy2afpaqtxqavfjd encrypt usernam wialon2 password 4stj9bvywxotxiyh encrypt tunnelgroup wialon type remoteaccess tunnelgroup wialon generalattribut addresspool pool139 defaultgrouppolici grouppolicywialon tunnelgroup wialon webvpnattribut groupalia wialon enabl classmap inspectiondefault match defaultinspectiontraff policymap type inspect dn presetdnsmap paramet messagelength maximum client auto messagelength maximum 512 policymap globalpolici class inspectiondefault inspect dn presetdnsmap inspect ftp inspect h323 h225 inspect h323 ra inspect rsh inspect rtsp inspect esmtp inspect sqlnet inspect skinni inspect sunrpc inspect xdmcp inspect sip inspect netbio inspect tftp inspect ipopt servicepolici globalpolici global prompt hostnam context callhom report anonym cryptochecksum447ec315ae30818a98f705fb1bf3fd75,Anyconnect client can't access local network,https://supportforums.cisco.com/discussion/12761241/anyconnect-client-cant-access-local-network,,,,,,,,
2016,everyon total newbi question goe in place written l2tp pptp gre type vpn tunnel exampl creat l2tp dialer authent form l2tp tunnel encapsul in gre tunnel first need sinc l2tp transfer layer 3 protocol need gre thing in document explan configur l2tp lac ln cours dialer client end gre exactli tunnel dialer  differ prefer one whole ipsecisakampencryptionmap phase understood well whole confus differ tunneldial type thank ahead willow,Types of Vpn`s`,https://supportforums.cisco.com/discussion/12766811/types-vpns,,,,,,,,
2016,one qeustion vpn licens connect vpn licens one time use gone forev asa 5506 understand come 2 max licens unless buy higher licens asa licens,ASA VPN,https://supportforums.cisco.com/discussion/12861476/asa-vpn,,,,,,,,
2016,site site ipsec tunnel across wan 1841 2811 router need udp port get side receiv ip forwardprotocol tri ip helper nt work helper address lan interfac wan phone switch lan subnet tri commun,Forward UDP from site to site across vpn,https://supportforums.cisco.com/discussion/12868536/forward-udp-site-site-across-vpn,,,,,,,,
2016,could find answer in googl use anyconnect softwar use client softwar like openvpn connect asa,ASA VPN clients,https://supportforums.cisco.com/discussion/12878971/asa-vpn-clients,,,,,,,,
2016,dear friend made sitetosit vpn use 02 asa 5555 in site runningsoftwar version 92 4 vpn up show asassppri config sh isak sa ikev1 sa ikev2 sa sessionid1 statu upact ike count1 child count1 tunnelid local remot statu role 268373031 20123100130500 2001743619500 readi respond encr aescbc keysiz 256 hash sha96 dh grp5 auth sign psk auth verifi psk lifeact time 86400272 sec child sa local selector 1069000 1069025565535 remot selector 10122000 10122025565535 esp spi inout 0xf89430e60x86a5cd8f tri ping one site anoth possibl result ping made research problem mani peopl say miss isakmp nattravers 20 command command alredi enabl nat exempt enabl made test disabl well,"VPN site-to-site UP, but not traffic",https://supportforums.cisco.com/discussion/12880086/vpn-site-site-not-traffic,,,,,,,,
2016,review site today set up anyconnect vpn base licens 5506x far found websit http networklessonscomsecurityciscoasaanyconnectremoteaccessvpn bottom ask membership fee nt like give random websit debtcredit card number obviou reason want know block ca nt see know trustworthi might rethink give money nt trust know guid like besid white paper pleas respond back,General VPN setup,https://supportforums.cisco.com/discussion/12880161/general-vpn-setup,,,,,,,,
2016,tri fix mtu bug anyconnect client current client connect asa5545x run version 90 4 code nt see anywher specifi svc mtu 1200 in webvpn group polici code releas anyon know go also done client switch softwar packag push out client broke vpn connect,Changing Anyconnect MTU on ASA or client,https://supportforums.cisco.com/discussion/12880171/changing-anyconnect-mtu-asa-or-client,,,,,,,,
2016,hubnd spoke vpn architectur realiz withsvti ikev1 ipsec hub connect singl isp like hardwar redund myhub instead creat doubl tunnelin spoke like use failov protocol 4000isr router way realiz simpli use io ipsec failov todeploy mychang router like asa may configur activ router let standbi receiv cheng thank johnni,Simple IOS VPN IPsec HUB and Spoke with Failover HUB,https://supportforums.cisco.com/discussion/12880631/simple-ios-vpn-ipsec-hub-and-spoke-failover-hub,,,,,,,,
2016,configur site site vpn seem get vpn filter work follow document http wwwciscocomimagegifpaws99103pixasavpnfilterpdf creat acl creat ace traffic want permit went site site group polici appli filter howev still ping remot network client nt allow remot network 1921682024here partial config accesslist test extend permit ip 19216820 2552552550 host 19216812 accesslist test extend deni ip grouppolici test intern grouppolici test attribut vpnfilter valu test tunnelgroup testtunnel type ipsecl2l tunnelgroup testtunnel generalattribut defaultgrouppolici test,Site to Site VPN filter,https://supportforums.cisco.com/discussion/12880766/site-site-vpn-filter,,,,,,,,
2016,got coupl asa5525x unit premium vpn licens connect connect client androind get messag licens found older thread forum suggest premium vpn licens abl request mobil base licens well unabl find inform correct,Any Connect License for Mobile,https://supportforums.cisco.com/discussion/12881226/any-connect-license-mobile,,,,,,,,
2016,everyon 40 branch central datacent everi offic connect dc internet traffic pass filter dc central firewal voip central call manag in dc data in dc except offic file server also rdp importand use day mpl network connect offic research implement dmvpn like second solut offic small one recommend expirienc one solut read voic traffic critic tricki manag isp dmvpn solut would realli aprici opinion regard thoma ps choos dmvpn caus in close futur backup dc in second offic critic data servic that think use dmvpn 2 hub,DMVPN Solution for 50 Branches...,https://supportforums.cisco.com/discussion/12881351/dmvpn-solution-50-branches,,,,,,,,
2016,guy tri get site site vpn work two 5505 in lab imag attach use wizard configur believ look good howev nt work run follow command communitysit sh ipsec sa ipsec sa believ gener traffic tri ping access ii one laptop without luck ping between asa work fine asa 5505 82 5 config commun site interfac ethernet00 descript outsid switchport access vlan 2 interfac ethernet01 descript insid interfac ethernet02 interfac vlan1 descript commun site nameif insid securitylevel 100 ip address 192168201 2552552550 interfac vlan2 nameif outsid securitylevel 50 ip address 10181102 2552552550 objectgroup network objani accesslist insideaccessin extend permit icmp accesslist insideaccessin extend permit ip accesslist outsideaccessin extend permit ip accesslist outsideaccessin extend permit icmp accesslist outside1cryptomap extend permit ip 192168200 2552552550 remotenetwork 2552552550 accesslist insidenat0outbound extend permit ip 192168200 2552552550 remotenetwork 2552552550 global outsid 1 interfac nat insid 0 accesslist insidenat0outbound nat insid 1 0000 0000 accessgroup insideaccessin in interfac insid accessgroup outsideaccessin in interfac outsid rout outsid 0000 0000 10181101 1 ipsec transformset esp3dessha esp3d espshahmac ipsec securityassoci lifetim second 28800 ipsec securityassoci lifetim kilobyt 4608000 map outsidemap 1 match address outside1cryptomap map outsidemap 1 set pf group1 map outsidemap 1 set peer 1018111 map outsidemap 1 set transformset esp3dessha map outsidemap interfac outsid isakmp enabl outsid isakmp polici 10 authent preshar encrypt 3de hash sha group 2 tunnelgroup 1018111 type ipsecl2l tunnelgroup 1018111 ipsecattribut config side corpor name 192168200 remotenetwork descript commun network interfac ethernet00 descript outsid switchport access vlan 2 interfac ethernet01 descript insid interfac ethernet02 interfac vlan1 descript torbay corp nameif insid securitylevel 100 ip address 192168101 2552552550 interfac vlan2 nameif outsid securitylevel 50 ip address 10181101 25525500 ftp mode passiv accesslist outsideaccessin1 extend permit ip accesslist outsideaccessin1 extend permit icmp accesslist insideaccessin1 extend permit ip accesslist insideaccessin1 extend permit icmp accesslist outside1cryptomap extend permit ip 192168100 2552552550 remotenetwork 2552552550 accesslist insidenat0outbound extend permit ip 192168100 2552552550 remotenetwork 2552552550 pager line 24 accessgroup outsideaccessin1 in interfac outsid accessgroup insideaccessin1 in interfac insid rout outsid 0000 0000 10181102 1 ipsec transformset esp3dessha esp3d espshahmac ipsec securityassoci lifetim second 28800 ipsec securityassoci lifetim kilobyt 4608000 map outsidemap 1 match address outside1cryptomap map outsidemap 1 set pf group1 map outsidemap 1 set peer 10181102 map outsidemap 1 set transformset esp3dessha map outsidemap interfac outsid isakmp enabl outsid isakmp polici 10 authent preshar encrypt 3de hash sha group 2 lifetim 86400 tunnelgroup 10181102 type ipsecl2l tunnelgroup 10181102 ipsecattribut presharedkey,Site to Site IPSec VPN Configuration,https://supportforums.cisco.com/discussion/12881461/site-site-ipsec-vpn-configuration,,,,,,,,
2016,good even seek help andor advis in regard ad network encrypt domain exist site site ipsec tunnel side tunnel asa custom remot end want access network end alreadi updat map acl includ new network perform show ipsec sa peer xxxx alreadi show encap packet attempt reach network side updat map acl refer 2 new network creat twice nat ad necessari acl allow inbound access via port want perform show ipsec sa peer xxxx output updat new network ad encrypt domain run packet tracer sourc one server in new network traffic translat drop hit outbound interfac get vpn tunnel miss someth need bounc tunnel in order new network recogn in sa thank in advanc,Help: Issues adding to encryption domain IPsec Tunnel,https://supportforums.cisco.com/discussion/12883261/help-issues-adding-encryption-domain-ipsec-tunnel,,,,,,,,
2016,asa anyconnect vpn microsoft ad ldap authent intunnelgroupi configuredpasswordmanag passwordexpireinday 14 work test seem possibl updat password iti alreadi expir way solv thank,VPN Anyconnect password-management if password is already expired,https://supportforums.cisco.com/discussion/12883356/vpn-anyconnect-password-management-if-password-already-expired,,,,,,,,
2016,haveanyconnect 25 premium peer licens anyconnect premium peer 25 perpetu vpn peer 750 perpetu total vpn peer 750 perpetu anyconnect mobil disabl perpetu anyconnect vpn phone disabl perpetu theni bought anyconnect 50 userapex licens registr asa devicewith pak numberso receiv followingcisco asa 5500 seri adapt secur applianc activ key anyconnect premium peer 750 vpn peer default advanc endpoint assess enabl anyconnect mobil enabl anyconnect vpn phone enabl seem 50 750anyconnect peer avail  thank,AnyConnect Apex License question,https://supportforums.cisco.com/discussion/12883396/anyconnect-apex-license-question,,,,,,,,
2016,everyon first off thank priceless inform commun provid techi newish ipsec vpn question dmz host pate public ip ihav set up ipsec tunnel extern organ outsid interfac allow host reach host in organ vpn come up told set up nat exempt ipsec traffic dmz host outsid host kindli regard mumo,IPSEC VPN DMZ HOST NAT,https://supportforums.cisco.com/discussion/12883741/ipsec-vpn-dmz-host-nat,,,,,,,,
