created,original_post,title,url,8CAT,7CAT,5CAT,4CAT,org data,,,
2015,commun get stuck in sitetosit vpn configur between asa os 91 io router io 1524m4 attach asa router configur also includ debug router output seem two side configur isakmp missmatch alreadi disabl keepal set also disabl pf set side nt work idea troubl pleas help help appreci thank,IPsec VPN site-to-site between ASA and Cisco Router problem. Please help,https://supportforums.cisco.com/discussion/12390946/ipsec-vpn-site-site-between-asa-and-cisco-router-problem-please-help,0,1,0,1,x,,,
2015,organ in process upgrad hardwar use establish vpn connect partner old hardwar 2811 oldcor router new one 4431 newcor partner use sonicwal devic end vpn connect vpn between oldcor sonicwal devic work fine howev tri replac oldcor newcor vpn connect come up check paramet oldcor newcor partner say anyth configur endthat would caus problem result sh cri isa sa newcor say ipv4 isakmp sa dst src state connid statu xxxxxxxxyyyyyyyy mmnostat 0 activ xxxxxxxxyyyyyyyy mmnostat 0 activ delet disconnect newcor replac oldcor vpn connect come back up without issu one strang thing ping public ip partner devic form oldcor public interfac newcor public interfac howev abl ping public ip partner devic form insid interfac newcor anyon issu fix ipsec vpn isakmp,Cannot create VPN with partner,https://supportforums.cisco.com/discussion/12542131/cannot-create-vpn-partner,0,1,0,1,x,,,
2015,two asa 5505 licenc base tri creat vpn ipsec use cli step made 1 configur asa1 hostnam vlan 1 vlan 2 2 configur rout static 3 creat object network local remot 4 creat accesslist 5 creat ikev1 6creat tunnelgroup 7configur nat repeat step anoth asa chang ip correct step creat vpn ipsec between devic firewal asa,ASA 5505- I can't create a VPN IPSEC between two ASA 5505,https://supportforums.cisco.com/discussion/12563236/asa-5505-i-cant-create-vpn-ipsec-between-two-asa-5505,0,1,0,1,x,,,
2015,haveestablishedvpn sitesit between 2 asasbranchtohq issu everi morn time site turnon asa devic tunnel come up unless irun follow command hqasa maptobranchinterfac outsid maptobranchinterfac outsid pleas instruct issu,Phase-2 Disconnecting,https://supportforums.cisco.com/discussion/12607526/phase-2-disconnecting,0,1,0,1,x,,,
2015,use anyconnect 25 everth work fine wantmust upgrad anyconnect 4x first purchas anyconnect apex licens instal still everi anyconnect attempt connect either end in contact server window valid certif avail authent mac set up asa 95 puzzl 1 nt use client certif authenti aaa 2 bare minium standard anyconnect config noth fanci despar instal anyconnect app ipad luck either play around turn fip lo behold could connect thing never configur fip disabl nonfip cipher exampl asa want need spent mani hour troubleshoot loss pointer greatli appreci updat found solut bug search found descript appli particular bug also affect anyconnect http toolsciscocombugsearchbugcscuv51649 referringsitebugqu take workaround state rc4sha out cipher made work also explain ipad app work fip fip doesnt use rc4sha,Anyconnect 4.x client cannot connect,https://supportforums.cisco.com/discussion/12711571/anyconnect-4x-client-cannot-connect,0,1,0,1,x,,,
2016,io router want setup ipsec tunnel between client unfortun overlap 10 network ip address possibl nat ip side client need nat well configur nat insid interfac 101342061 1921681566 nat occur packet get encrypt tunnel howev tunnel come up client use sonic firewal allow 192168156024 10910016 network see attach regard 2821 vpn ipsec,IPSec tunnel and policy Nat,https://supportforums.cisco.com/discussion/12752036/ipsec-tunnel-and-policy-nat,0,1,0,1,x,,,
2016,run anyconnect client environ io router 2921 headend devic upgrad clientpackag router latest version3113015 autoinstal packag client discov bug window base machin abl establish vpn connect anymor authent autoupgrad packag still work afterward error messag appear unabl similiar revert packag router back older version 3111004 bee autoinstal client newer buggi version connect way configur router forc downgrad client way work around manual uninstal packag client thank heinz,Automatic downgrade of Anyconnect Client (IOS Router),https://supportforums.cisco.com/discussion/12862321/automatic-downgrade-anyconnect-client-ios-router,0,1,0,1,x,,,
2016,network kind special setup – 101020024 gateway 1010201 router rout traffic 17216137024 host applic server traffic goe new asa5506 1010202 suppli internet access handl vpn connect – problem client connect via vpn tri go 1721613740 host test server access – ping 1721613740 asa comput 1010200network – think miss nat ’ get head around asa version 95 1 name ip local pool vpnpool 1721611172161254 mask 2552552550 ip local pool vpntool2 1721621172162254 mask 2552552550 interfac gigabitethernet11 nameif outsid securitylevel 0 ip address 1234 255255255252 interfac gigabitethernet12 nameif insid securitylevel 100 ip address 1010202 2552552550 interfac gigabitethernet13 shutdown nameif securitylevel ip address interfac gigabitethernet14 shutdown nameif securitylevel ip address interfac gigabitethernet15 shutdown nameif securitylevel ip address interfac gigabitethernet16 shutdown nameif securitylevel ip address interfac gigabitethernet17 shutdown nameif securitylevel ip address interfac gigabitethernet18 nameif dmz securitylevel 50 ip address 1020201 2552552550 interfac management11 managementonli nameif securitylevel ip address ftp mode passiv samesecuritytraff permit interinterfac samesecuritytraff permit intrainterfac object network basicit host 865212814 object network kmd subnet 842556464 255255255224 object network sql host 1010209 object network bitremot host 1010207 object network httpsfjern host 1010206 object network smtp host 1010206 object network httpdmz host 1020202 object network networkobj172161024 subnet 1721610 2552552550 object network networkobj172162024 subnet 1721620 2552552550 object network 1010200lan subnet 1010200 2552552550 object network test host 10102044 object network networkobj101020024 subnet 1010200 2552552550 object network httptsserver host 1020202 object network serverexc host 1010206 object network vpnpooltunnel subnet 1721610 2552552550 object network remoteserv subnet 172161370 2552552550 object network networkobj102020024 subnet 1020200 2552552550 accesslist outsideaccessin extend permit tcp object basicit object serverexc eq 3389 accesslist outsideaccessin extend permit tcp object serverexc eq smtp accesslist outsideaccessin extend permit tcp object httpdmz eq www accesslist outsideaccessin extend permit tcp object serverexc eq http accesslist outsideaccessin extend permit tcp host 1010209 eq 444 accesslist vpnsplittunnelacl standard permit 1010200 2552552550 accesslist vpnsplittunnelacl standard permit 172161370 2552552550 accesslist vpnsplittunnelacl standard permit 1020200 2552552550 accesslist vpntestsplittunnelacl standard permit 1010200 2552552550 pager line 24 log enabl log asdm inform mtu outsid 1500 mtu insid 1500 mtu dmz 1500 icmp unreach ratelimit 1 burstsiz 1 asdm imag disk0 asdm752153bin asdm histori enabl arp timeout 14400 arp permitnonconnect nat dmz outsid sourc static networkobj102020024 networkobj102020024 destin static networkobj172161024 networkobj172161024 noproxyarp routelookup nat dmz outsid sourc static networkobj102020024 networkobj102020024 destin static networkobj172162024 networkobj172162024 noproxyarp routelookup nat insid outsid sourc static networkobj101020024 networkobj101020024 destin static networkobj172162024 networkobj172162024 noproxyarp routelookup nat insid outsid sourc static networkobj101020024 networkobj101020024 destin static networkobj172161024 networkobj172161024 noproxyarp routelookup object network ffktsql nat insid outsid static interfac servic tcp 444 444 object network bitremot nat insid outsid static interfac servic tcp 3389 3389 object network httpsfjern nat insid outsid static interfac servic tcp http http object network smtp nat insid outsid static interfac servic tcp smtp smtp object network httptsserver nat dmz outsid static interfac servic tcp www www nat dmz outsid afterauto sourc dynam interfac nat insid outsid afterauto sourc dynam interfac accessgroup outsideaccessin in interfac outsid rout outsid 0000 0000 1234 1 rout insid 172161370 2552552550 1010201 1 timeout xlate 30000 timeout patxlat 00030 timeout conn 10000 halfclos 01000 udp 00200 icmp 00002 timeout sunrpc 01000 h323 00500 h225 10000 mgcp 00500 mgcppat 00500 timeout sip 03000 sipmedia 00200 sipinvit 00300 sipdisconnect 00200 timeout sipprovisionalmedia 00200 uauth 00500 absolut timeout tcpproxyreassembl 00100 timeout floatingconn 00000 aaaserv shvdc01 protocol radiu aaaserv shvdc01 insid host 1010207 key radiuscommonpw userident defaultdomain local http server enabl 4444 http 0000 0000 insid,VPN client route to different lan,https://supportforums.cisco.com/discussion/12883321/vpn-client-route-different-lan,0,1,0,1,x,,,
2016,anyconnect setup two locat fiber point point between two locat commun across issu local want abl use anyconnect connect branch also abl access resourc across ptp branch b tri configur chang split tunnel noth seem get across attach asa config help would greatli appreci site 1921681x site b 192168200x,Anyconnect to fiber site-to-site VPN destination,https://supportforums.cisco.com/discussion/12923696/anyconnect-fiber-site-site-vpn-destination,0,1,0,1,x,,,
2016,vendor use window server 2012 r2 see client pass authent connect promptli disconnect without establish session version anyconnect 4201035,"Anyconnect disconnects client after clicking on ""accept"".",https://supportforums.cisco.com/discussion/12941196/anyconnect-disconnects-client-after-clicking-accept,0,1,0,1,x,,,
2016,face problem ssh access asa5512 vpn site2sit tunnel ssh seem set up correctli initi session insid outsid interfac whenw tri connect asa remot site sshputti report time out setup up lot configur asa5510 asa imag 8x without problem guess must someth new asa version defaultrsakey gener success vpn ok log viewer show 6 mar 21 2016 102144 302013 1921680100 51682 19216811 22 built inbound tcp connect 597903 outside192168010051682 192168010051682 inside1921681122 1921681122 setup configur aaa authent ssh consol local ssh 19216800 2552552550 insid 19216800 remot vpn network managementaccess insid usernameus password passwort privileg 15 miss anyth thank best regard denni,Manage ASA 5512 with SSH over VPN,https://supportforums.cisco.com/discussion/12942946/manage-asa-5512-ssh-over-vpn,0,1,0,1,x,,,
2016,ipsec tunnel between old routerto remot site migrat 887 config asa remot site unabl establish tunnel site issu number remot site connect back without issu setup 1921681x main site insid asa 86xxx outsid internet 159xxx remot side outsid firewal 101010x remot site accept 1921681x rang nate 19216850x want see config object network nattoremote1 subnet 192168500 2552552550 object network remote1 subnet 1010100 2552552520 nat insid outsid sourc static 19216810 nattoremote1 destin static remote1 remote1 ikev1 polici 30 authent preshar encrypt 3de hash sha group 2 lifetim 86400 ipsec ikev1 transformset 3dessha1 esp3d espshahmac map outsidemap 10 match address qualcomvpn map outsidemap 10 set peer 159xxx map outsidemap 10 set ikev1 transformset 3dessha1 map outsidemap 10 set pf group1 map outsidemap interfac outsid accesslist remotesitevpn extend permit ip host 1921685020 1010100 2552552520 accesslist remotesitevpn extend permit ip host 1921685030 1010100 2552552520 accesslist remotesitevpn extend permit ip host 1921685040 1010100 2552552520 tunnelgroup 159xxx type ipsecl2l tunnelgroup 159xxx generalattribut defaultgrouppolici remotesit tunnelgroup 159xxx ipsecattribut ikev1 presharedkey wonder miss someth obviou,Problem with IPSEC tunnel with NAT,https://supportforums.cisco.com/discussion/12980316/problem-ipsec-tunnel-nat,0,1,0,1,x,,,
2016,unabl build site site vpn tunnel between asa 5505 3030 tri everi possibl combin except one work abl ping peer site anyon config between two work lan lan tunnel between 5505 3030 work thank site site lan lan vpn tunnel,Lan to Lan tunnel between ASA 5505 and 3030.,https://supportforums.cisco.com/discussion/12985906/lan-lan-tunnel-between-asa-5505-and-3030,0,1,0,1,x,,,
2016,scratch head one tri set up vpn tunnel between 2801 end sonicwal tz215 remot end seem get phase 1 fine keep tank phase 2 conflict between local remot network scheme rather avoid nat abl hit remot server privat side address border router 2801 keep vpn pix traffic flag in pix head out fiber rather default rout whenev need go avpn definit take right path out pix in nat0 though test 2801 hope get tunnel up first without overcompl thing got 2 vpn run devic one use 3de one use ae ijust copi config similar work vpn chang ip polici number use 3de seem get phase 1 fine fail phase 2 use ae fail phase 1 snip theconfig use 2801 interfac fastethernet01 ip address public ip router 255255255224 ip nat outsid ip virtualreassembl duplex auto speed auto map outsidemap isakmp polici 40 encr 3de hash md5 authent preshar group 2 isakmp key address aaabbbcccddd remot public address endpoint in sonicwal ipsec transformset espdesmd5 espd espmd5hmac ipsec transformset esp3desmd5 esp3d espmd5hmac ipsec transformset hryak ahshahmac espa 256 ipsec transformset espaes256md5 espa 256 espmd5hmac map outsidemap 40 ipsecisakmp set peer aaabbbcccddd remot public ip address set transformset esp3desmd5 match address 140 accesslist 140 permit ip host global nat bbbcccdddeee 000255 remot privat side network 24 accesslist 140 permit tcp host global nat bbbcccdddeee 000255 remot privat side network 24 see in syslog 20160420 133901 local7debug 10239201 50 apr 20 200248056 ipsec ipsecprocesspropos proxi ident support 20160420 133901 local7debug 10239201 51 apr 20 200248056 isakmp 4706 ipsec polici invalid propos error 32 20160420 133901 local7debug 10239201 52 apr 20 200248056 isakmp 4706 phase 2 sa polici accept local routerpublicip remot remotepublicip 20160420 133901 local7debug 10239201 53 apr 20 200248060 isakmp 4706 delet node660087920 error true reason qm reject 20160420 133916 local7debug 10239201 54 apr 20 200302816 mapdbfindbest find match map 20160420 133916 local7debug 10239201 55 apr 20 200302816 ipsec ipsecprocesspropos proxi ident support 20160420 133916 local7debug 10239201 56 apr 20 200302816 isakmp 4706 ipsec polici invalid propos error 32 20160420 133916 local7debug 10239201 57 apr 20 200302816 isakmp 4706 phase 2 sa polici accept local routerpublicip remot remotepublicip 20160420 133916 local7debug 10239201 58 apr 20 200302820 isakmp 4706 delet node765628656 error true reason qm reject suggest look next step mani thank,VPN site-to-site between Cisco 2801 Sonicwall TZ 215,https://supportforums.cisco.com/discussion/12988741/vpn-site-site-between-cisco-2801-sonicwall-tz-215,0,1,0,1,x,,,
2016,out sudden ipsec tunnel remot site 2026821120 connect previous ok config chang ike phase 1 even connect debug nt know might error putti log 20160512 151936 may 12 120650 ikev1 debug pitcher receiv key acquir messag spi 0x0 may 12 120650 ikev1 ip 2026821120 queu keyacquir messag process p1 sa complet may 12 120653 ikev1 debug pitcher receiv key acquir messag spi 0x0 may 12 120653 ikev1 ip 2026821120 queu keyacquir messag process p1 sa complet may 12 120654 ikev1 debug ip 2026821120 ike mm initi fsm error histori struct 0xd84aff40 lt state lt event mmdone everror mmwaitmsg2 evretri mmwaitmsg2 evtimeout mmwaitmsg2 nullev mmsndmsg1 evsndmsg mmsndmsg1 evstarttmr mmsndmsg1 evresendmsg mmwaitmsg2 evretri may 12 120654 ikev1 debug ip 2026821120 ike sa mm914f04ce termin flag 0x01000022 refcnt 0 tuncnt 0 may 12 120654 ikev1 debug ip 2026821120 send deletedelet reason messag may 12 120659 ikev1 debug pitcher receiv key acquir messag spi 0x0 may 12 120659 ikev1 ip 2026821120 ike initi new phase 1 intf intern ike peer 2026821120 local proxi address 10215200 remot proxi address 1021000 map vpnmap may 12 120659 ikev1 debug ip 2026821120 construct isakmp sa payload may 12 120659 ikev1 debug ip 2026821120 construct fragment vid extend capabl payload may 12 120659 ikev1 ip 2026821120 ikedecod send messag msgid0 payload hdr sa 1 vendor 13 none 0 total length 112 may 12 120700 ikev1 debug pitcher receiv key acquir messag spi 0x0 may 12 120700 ikev1 ip 2026821120 queu keyacquir messag process p1 sa complet may 12 120703 ikev1 debug pitcher receiv key acquir messag spi 0x0 may 12 120703 ikev1 ip 2026821120 queu keyacquir messag process p1 sa complet may 12 120707 ikev1 ip 2026821120 ikedecod resend messag msgid0 payload hdr sa 1 vendor 13 none 0 total length 112 may 12 120709 ikev1 debug pitcher receiv key acquir messag spi 0x0 may 12 120709 ikev1 ip 2026821120 queu keyacquir messag process p1 sa complet may 12 120715 ikev1 ip 2026821120 ikedecod resend messag msgid0 payload hdr sa 1 vendor 13 none 0 total length 112 may 12 120723 ikev1 ip 2026821120 ikedecod resend messag msgid0 payload hdr sa 1 vendor 13 none 0 total length 112 may 12 120731 ikev1 debug ip 2026821120 ike mm initi fsm error histori struct 0xd8457958 lt state lt event mmdone everror mmwaitmsg2 evretri mmwaitmsg2 evtimeout mmwaitmsg2 nullev mmsndmsg1 evsndmsg mmsndmsg1 evstarttmr mmsndmsg1 evresendmsg mmwaitmsg2 evretri may 12 120731 ikev1 debug ip 2026821120 ike sa mm be63ea64 termin flag 0x01000022 refcnt 0 tuncnt 0 may 12 120731 ikev1 debug ip 2026821120 send deletedelet reason messag may 12 120737 ikev1 debug pitcher receiv key acquir messag spi 0x0 may 12 120737 ikev1 ip 2026821120 ike initi new phase 1 intf intern ike peer 2026821120 local proxi address 10215200 remot proxi address 1021000 map vpnmap may 12 120737 ikev1 debug ip 2026821120 construct isakmp sa payload may 12 120737 ikev1 debug ip 2026821120 construct fragment vid extend capabl payload may 12 120737 ikev1 ip 2026821120 ikedecod send messag msgid0 payload hdr sa 1 vendor 13 none 0 total length 112 may 12 120740 ikev1 debug pitcher receiv key acquir messag spi 0x0 may 12 120740 ikev1 ip 2026821120 queu keyacquir messag process p1 sa complet may 12 120745 ikev1 ip 2026821120 ikedecod resend messag msgid0 payload hdr sa 1 vendor 13 none 0 total length 112 may 12 120746 ikev1 debug pitcher receiv key acquir messag spi 0x0 may 12 120746 ikev1 ip 2026821120 queu keyacquir messag process p1 sa complet may 12 120753 ikev1 ip 2026821120 ikedecod resend messag msgid0 payload hdr sa 1 vendor 13 none 0 total length 112 q,IPSEC tunnel not connect,https://supportforums.cisco.com/discussion/13020821/ipsec-tunnel-not-connect,0,1,0,1,x,,,
2016,commun set l2l vpn between asa cyberhom get error messag asa tunnel come up jun 07 070836 ikev1 ip xxxxxxxxxxxx next payload 4 jun 07 070855 ikev1 ip xxxxxxxxxxxx next payload 4 jun 07 070936 ikev1 group xxxxxxxxxxxx ip xxxxxxxxxxxx ca nt find valid tunnel group abort jun 07 070946 ikev1 ip xxxxxxxxxxxx next payload 4 jun 07 071006 ikev1 ip xxxxxxxxxxxx next payload 4 jun 07 071047 ikev1 group xxxxxxxxxxxx ip xxxxxxxxxxxx ca nt find valid tunnel group abort reason regard,"Header invalid, missing SA payload!",https://supportforums.cisco.com/discussion/13040141/header-invalid-missing-sa-payload,0,1,0,1,x,,,
2016,recent receiv asa 5505 spent week figur out set up vpn day final found solut connect asa vpn client yet acc devic connect asa config asa version 82 5 hostnam asa01 domainnam kevinasa01net enabl password 8ry2yjiyt7rrxu24 encrypt passwd 2kfqnbnidi2ky encrypt name interfac ethernet00 switchport access vlan 2 interfac ethernet01 interfac ethernet02 interfac ethernet03 switchport access vlan 5 interfac ethernet04 interfac ethernet05 interfac ethernet06 interfac ethernet07 interfac vlan1 nameif insid securitylevel 100 ip address 19216811 2552552550 interfac vlan2 nameif outsid securitylevel 0 ip address dhcp setrout interfac vlan5 nameif securitylevel 50 ip address 1721611 2552552550 ftp mode passiv dn servergroup defaultdn domainnam kevinasa01net samesecuritytraff permit intrainterfac accesslist remotekevinsplittunnelacl standard permit 19216810 2552552550 accesslist insidenat0outbound extend permit ip 19216810 2552552550 1921682540 255255255240 accesslist insidenat0outbound extend permit ip 1921682540 2552552550 accesslist insidenat0outbound extend permit ip 19216810 2552552550 accesslist nonatin extend permit ip 1921682540 2552552550 19216810 2552552550 accesslist outsideaccessin extend permit ip 1921682540 2552552550 accesslist insideaccessin extend permit ip 1921682540 2552552550 pager line 24 log asdm inform mtu outsid 1500 mtu insid 1500 ip local pool pool 192168254119216825410 mask 2552552550 icmp unreach ratelimit 1 burstsiz 1 asdm histori enabl arp timeout 14400 global outsid 1 interfac nat outsid 1 1921682540 2552552550 nat insid 0 accesslist nonatin nat insid 1 19216810 2552552550 nat insid 1 0000 0000 accessgroup outsideaccessin in interfac outsid timeout xlate 30000 timeout conn 10000 halfclos 01000 udp 00200 icmp 00002 timeout sunrpc 01000 h323 00500 h225 10000 mgcp 00500 mgcppat 00500 timeout sip 03000 sipmedia 00200 sipinvit 00300 sipdisconnect 00200 timeout sipprovisionalmedia 00200 uauth 00500 absolut timeout tcpproxyreassembl 00100 timeout floatingconn 00000 dynamicaccesspolicyrecord dfltaccesspolici http server enabl http 19216810 2552552550 insid snmpserver locat snmpserver contact snmpserver enabl trap snmp authent linkup linkdown coldstart ipsec transformset esp3dessha esp3d espshahmac ipsec transformset esp3desmd5 esp3d espmd5hmac ipsec transformset espdesmd5 espd espmd5hmac ipsec transformset espaes128sha espa espshahmac ipsec transformset espaes192sha espaes192 espshahmac ipsec transformset espaes128md5 espa espmd5hmac ipsec transformset espaes192md5 espaes192 espmd5hmac ipsec transformset espaes256sha espaes256 espshahmac ipsec transformset espaes256md5 espaes256 espmd5hmac ipsec transformset espdessha espd espshahmac ipsec securityassoci lifetim second 28800 ipsec securityassoci lifetim kilobyt 4608000 dynamicmap systemdefaultcryptomap 65535 set pf group1 dynamicmap systemdefaultcryptomap 65535 set transformset espaes128sha espaes128md5 espaes192sha espaes192md5 espaes256sha espaes256md5 esp3dessha esp3desmd5 espdessha espdesmd5 map outsidemap 65535 ipsecisakmp dynam systemdefaultcryptomap map outsidemap interfac outsid isakmp enabl outsid isakmp polici 10 authent preshar encrypt 3de hash sha group 2 lifetim 86400 telnet timeout 5 ssh timeout 5 consol timeout 0 managementaccess insid dhcpd autoconfig outsid dhcpd address 19216815192168136 insid dhcpd enabl insid threatdetect basicthreat threatdetect statist accesslist threatdetect statist tcpintercept webvpn grouppolici remotekevin intern grouppolici remotekevin attribut dnsserver valu 192168112 192168113 vpnsimultaneouslogin 3 vpntunnelprotocol ipsec splittunnelpolici tunnelspecifi splittunnelnetworklist valu remotekevinsplittunnelacl defaultdomain valu kevinasa01net usernam kevin password mz6jxjibsqqvsw9 encrypt privileg 0 usernam kevin attribut vpngrouppolici remotekevin tunnelgroup remotekevin type remoteaccess tunnelgroup remotekevin generalattribut addresspool pool defaultgrouppolici remotekevin tunnelgroup remotekevin ipsecattribut presharedkey classmap inspectiondefault match defaultinspectiontraff policymap type inspect dn presetdnsmap paramet messagelength maximum client auto messagelength maximum 512 policymap globalpolici class inspectiondefault inspect dn presetdnsmap inspect ftp inspect h323 h225 inspect h323 ra inspect rsh inspect rtsp inspect esmtp inspect sqlnet inspect skinni inspect sunrpc inspect xdmcp inspect sip inspect netbio inspect tftp inspect ipopt inspect icmp inspect icmp error servicepolici globalpolici global prompt hostnam context callhom report anonym cryptochecksum2bb1da52d1993eb9b13c2f6dc97c16cd end thank,"ASA 5505 VPN Established, Cannot acces inside network",https://supportforums.cisco.com/discussion/13049641/asa-5505-vpn-etablished-cannot-acces-inside-network,0,1,0,1,x,,,
2015,everyon problem site site vpn between two router configur site isakmp polici 10 encr 3de authent preshar group 2 lifetim 86000 isakmp key secrettestkey address xxxx ipsec transformset s2 esp3d espshahmac map s2 10 ipsecisakmp set peer xxxx set transformset s2 match address s2 interfac fastethernet4 ip address yyyi 255255255252 ip nat outsid ip virtualreassembl duplex auto speed auto map s2 interfac vlan1 ip address interfac vlan12 ip address 1921681001 2552552550 ip nat insid ip virtualreassembl ip forwardprotocol nd ip http server ip http secureserv ip nat insid sourc list 100 interfac fastethernet4 overload ip rout 0000 0000 yyyx ip rout 192168140 2552552550 yyyx ip accesslist extend s2 permit ip 1921681000 000255 192168140 000255 accesslist 100 deni ip 1921681000 000255 192168140 000255 accesslist 100 permit ip 1921681000 000255 site b isakmp polici 20 encr 3de authent preshar group 2 lifetim 86000 isakmp key secrettestkey address xxxx ipsec transformset tests2 esp3d espshahmac map dcmap 20 ipsecisakmp descript test tunnel set peer xxxx set transformset tests2 match address tests2 interfac gigabitethernet00 descript outsid ip address yyyi 255255255224 ip accessgroup outside2insid in ip nat outsid ip virtualreassembl duplex auto speed auto mediatyp rj45 map dcmap ip rout 1921681000 2552552550 yyyx ip accesslist extend tests2 permit ip 192168140 000255 1921681000 000255 also natt configur site tunnel come up statu ismmnost caus problem pleas advis,Site to site vpn problem,https://supportforums.cisco.com/discussion/12404696/site-site-vpn-problem,0,1,0,1,,,,
