created,original_post,title,url,8CAT,7CAT,5CAT,4CAT,org data,,,
2015,asa 5505 setup up vpn connect recent everyth intern vlan 120 work fine use vpn although vpn client access voic vlan 200 ad voic network acl list map anyconnect connect profil still go idea config interfac vlan2 nameif outsid securitylevel 0 ip address 255255255252 banner login warn privat network devic author access unauthor access allow log proper action taken banner motd nt access router without proper author boot system disk0 asa914k8bin ftp mode passiv dn domainlookup outsid dn servergroup defaultdn nameserv 75757575 nameserv 75757676 domainnam valleyviewloc object network obj101935248 subnet 101935248 255255255248 object network obj1019350 subnet 1019350 2552552550 object network obj101935230 host 101935230 object network obj10193523002 host 101935230 object network obj10193523003 host 101935230 object network obj10193577 host 10193577 object network obj1019357701 host 10193577 object network obj10193523004 host 101935230 object network obj10193523005 host 101935230 object network objani subnet 0000 0000 object network exchang host 101935230 object network vpnnetwork subnet 192168220 255255255248 object network voicenetwork subnet 1020010 2552552550 descript voic network object network vpnclient subnet 192168220 255255255248 object network networkobj19216822029 subnet 192168220 255255255248 objectgroup network dminlinenetwork1 networkobject 0000 0000 networkobject object voicenetwork accesslist insideout extend permit ip host 101935230 any4 accesslist insideout extend deni tcp 1019350 2552552550 any4 eq smtp log debug accesslist insideout extend permit ip 1019350 2552552550 any4 accesslist insideout extend permit ip object voicenetwork accesslist insideout extend permit ip object vpnclient inact accesslist extend extend permit gre any4 host 17316335105 accesslist oustsidein extend permit gre any4 host 17316335105 inact accesslist vpnuserssplittunnelacl standard permit 1019350 2552552550 accesslist insidenat0outbound extend permit ip any4 101935248 255255255248 accesslist insidenat0outbound extend permit ip 1019350 2552552550 101935248 255255255248 accesslist defaultragroupsplittunnelacl standard permit any4 accesslist vpnsplittunnelacl standard permit any4 accesslist vvnvpnsplittunnelacl standard permit 1019350 2552552550 accesslist outsidein extend permit tcp any4 host 101935230 eq www inact,Anyconnect Vlan access,https://supportforums.cisco.com/discussion/12422401/anyconnect-vlan-access,2,2,2,2,,,,
2015,configur asa 5505 anyconnect traffic vpnpool local network dropp traffic insid network vpn client nt drop help asa 5505 vpn,VPN dropping traffic,https://supportforums.cisco.com/discussion/12424506/vpn-dropping-traffic,2,2,2,2,,,,
2015,run anyconnect vpn servic use sslv3 poodl move onto tlsv1 work fine recent advis tlsv1 also vulner poodl upgrad latest version firewal softwar asa 5512 enabl tlsv12 stop vpn work enabl anyconnect client start report behind captiv portal despit fact definit captiv portal get problem tlsv11 get work realli stuck expert mani thank,CISCO Anyconnect and using TLS V1.2,https://supportforums.cisco.com/discussion/12434451/cisco-anyconnect-and-using-tls-v12,2,2,2,2,,,,
2015,asa 5525 v 91 5 19 anyconnect client 3102026 two user unabl connect via ac client clientless web portal use client get stuck in loop check updat portal connect proceed point secur desktop success valid success reloadingpleas wait hang issu occur user regardless compani laptop log onto help desk tech use laptop success connect connect laptop anoth laptop user soth issuedo nt seem relat laptop ac instal help desk reimag machin earli in troubleshoot process realiz issu seem follow user updat hostscan file chang in result client clientless connect seem work fine user stump suggest anyon thank anyconnect client check updat portal,Anyconnect client and clientless connections hang for two users,https://supportforums.cisco.com/discussion/12441226/anyconnect-client-and-clientless-connections-hang-two-users,2,2,2,2,,,,
2015,vpn site site between hcm singapo hcm fortig 80c singapo 2900 problem today ca nt ping ip privat singapo 1921684024 ip privat hcm 1921681025 05 ping hcm singapo singapo ping hcm wassucce file config fotiga u help thank lot,"Troubleshoot VPN, Help me, Please",https://supportforums.cisco.com/discussion/12441531/troubleshoot-vpn-help-me-please,2,2,2,2,,,,
2015,dear firewal asa5510 in remot vpn client user connect cant ping access dmz server 19216835 cant also ping out side interfac 192168210 show run pleas help sh run asa5510 config sh run save serial number jmx1243l2be hardwar asa5510 256 mb ram cpu pentium 4 celeron 1599 mhz asa version 82 5 55 hostnam maje enabl password ufwsxxkwdnx8am8f encrypt passwd 2kfqnbnidi2ky encrypt name dnsguard interfac ethernet00 nameif outsid securitylevel 0 ip address 192168210 2552552550 interfac ethernet01 nameif insid securitylevel 100 ip address 192168110 2552552550 interfac ethernet02 nameif server securitylevel 90 ip address 192168310 2552552550 interfac ethernet03 shutdown nameif securitylevel ip address interfac management00 shutdown nameif securitylevel ip address boot system disk0 asa82555k8bin ftp mode passiv samesecuritytraff permit interinterfac samesecuritytraff permit intrainterfac accesslist acloutsid extend permit ip 19216850 2552552550 19216810 2552552550 accesslist acloutsid extend permit icmp 19216850 2552552550 19216810 2552552550 accesslist acloutsid extend permit ip accesslist acloutsid extend permit icmp accesslist aclinsid extend permit ip host 1921681150 19216850 2552552550 accesslist aclinsid extend permit icmp host 1921681150 19216850 2552552550 accesslist aclinsid extend permit ip host 1921681200 19216850 2552552550 accesslist aclinsid extend permit icmp host 1921681200 19216850 2552552550 accesslist aclinsid extend permit ip host 192168113 19216850 2552552550 accesslist aclinsid extend permit icmp host 192168113 19216850 2552552550 accesslist aclinsid extend permit ip 19216810 2552552550 host 19216835 accesslist aclinsid extend permit icmp 19216810 2552552550 host 19216835 accesslist aclinsid extend deni ip 19216810 2552552550 19216850 2552552550 accesslist aclinsid extend deni icmp 19216810 2552552550 19216850 2552552550 accesslist aclinsid extend permit ip accesslist aclinsid extend permit icmp accesslist aclserv extend permit ip accesslist aclserv extend permit icmp accesslist locallanaccess standard permit 10000 255000 accesslist locallanaccess standard permit 1721600 25524000 accesslist locallanaccess standard permit 19216800 25525500 accesslist nat0 extend permit ip 19216800 25525500 19216800 25525500 accesslist aclserv extend permit ip accesslist aclserv extend permit icmp pager line 24 mtu outsid 1500 mtu insid 1500 mtu server 1500 ip local pool vpnpool 192168511921685100 mask 2552552550 icmp unreach ratelimit 1 burstsiz 1 asdm imag disk0 asdm621bin asdm histori enabl arp timeout 14400 global outsid 1 interfac global server 1 interfac nat insid 0 accesslist nat0 nat insid 1 19216814 255255255255 nat insid 1 19216819 255255255255 nat insid 1 192168127 255255255255 nat insid 1 192168156 255255255255 nat insid 1 1921681150 255255255255 nat insid 1 1921681200 255255255255 nat insid 1 19216825 255255255255 nat insid 1 19216810 2552552550 nat insid 1 192168196 192168196 nat server 0 accesslist nat0 nat server 1 19216835 255255255255 static insid server 19216810 19216810 netmask 2552552550 static server insid 19216835 19216835 netmask 255255255255 accessgroup acloutsid in interfac outsid accessgroup aclserv in interfac server rout outsid 0000 0000 192168215 1 timeout xlate 30000 timeout conn 10000 halfclos 01000 udp 00200 icmp 00002 timeout sunrpc 01000 h323 00500 h225 10000 mgcp 00500 mgcppat 00500 timeout sip 03000 sipmedia 00200 sipinvit 00300 sipdisconnect 00200 timeout sipprovisionalmedia 00200 uauth 00500 absolut timeout tcpproxyreassembl 00100 timeout floatingconn 00000 dynamicaccesspolicyrecord dfltaccesspolici http server enabl http 19216810 2552552550 insid http 19216835 255255255255 server snmpserver locat snmpserver contact snmpserver enabl trap snmp authent linkup linkdown coldstart ipsec transformset esp3dessha esp3d espshahmac ipsec securityassoci lifetim second 28800 ipsec securityassoci lifetim kilobyt 4608000 dynamicmap outsidedynmap 10 set transformset esp3dessha dynamicmap outsidedynmap 10 set securityassoci lifetim seconds288000 dynamicmap outsidedynmap 10 set securityassoci lifetim kilobyt 4608000 dynamicmap outsidedynmap 10 set reverserout map outsidemap 10 ipsecisakmp dynam outsidedynmap map outsidemap interfac outsid isakmp ident hostnam isakmp enabl outsid isakmp polici 10 authent preshar encrypt 3de hash sha group 2 lifetim 86400 isakmp polici 65535 authent preshar encrypt 3de hash sha group 2 lifetim 86400 isakmp nattravers telnet 19216820 2552552550 outsid telnet 19216810 2552552550 insid telnet 19216830 2552552550 server telnet 192168380 2552552550 server telnet timeout 5 ssh timeout 5 consol timeout 0 threatdetect basicthreat threatdetect statist accesslist threatdetect statist tcpintercept webvpn grouppolici vpn intern grouppolici vpn attribut vpntunnelprotocol ipsec splittunnelpolici tunnelspecifi splittunnelnetworklist valu locallanaccess nem enabl usernam qaedah password ipsf4w9g6cgueusu encrypt usernam moneef password fllcyojakdnwmxsq encrypt usernam sabeen password x7esmrqnbio5eqo9 encrypt usernam sanaa2 password zha8fdvvtkigfomi encrypt usernam sanaa password x5fvxsdxboihq68a encrypt usernam sanaa1 password x5fvxsdxboihq68a encrypt usernam bajel password dygnlmmkxozq3dx encrypt privileg 15 usernam dari password bggty7d1rfi8p2zh encrypt usernam taiz password ip3hngcpyhygaqt encrypt usernam damt password gz1oufaq9ro2njor encrypt privileg 15 usernam aden password mdmcehcre64oxrqv encrypt usernam hodaidah password iycjprqpitkhgyc encrypt usernam yareem password ctc9wxl2ewdhh2xi encrypt usernam mdmd password zwyse3hs2vachb encrypt usernam haja password q25wf61gjmyjrkj encrypt usernam password 3usucopfuimco4jk encrypt usernam ibbmr password cnnadp0cvqzcjby5 encrypt usernam ibbr password ojnidnct0fbv3osi encrypt usernam ibbr password 2mx3ua4acabe8uop encrypt usernam ibbr1 password wiq4lrshub3geban encrypt usernam torba password c0euqrqwxsd5wnj encrypt usernam shibam password xjatjwrzyxm34 encrypt usernam ibbreef password 2mx3ua4acabe8uop encrypt usernam torbah password r3ignotsy1cddn encrypt usernam thamar password 1jatoquxf3q9ivcu encrypt usernam dhamar password pjdo55osunksvio encrypt usernam main password jsqqrh5gu772tkf encrypt usernam main1 password ef7y88xzpo6o9m1 encrypt usernam maeen password oyxnayhuv80bb0th encrypt usernam maje password 7i3uhzgjnviwi2q encrypt usernam lahj password qoazdon5rwd6gbni encrypt tunnelgroup vpn type remoteaccess tunnelgroup vpn generalattribut addresspool vpnpool defaultgrouppolici vpn tunnelgroup vpn ipsecattribut presharedkey classmap inspectiondefault match defaultinspectiontraff,Urgent Issue: vpn remote users cant reach dmz server,https://supportforums.cisco.com/discussion/12442101/urgent-issue-vpn-remote-users-cant-reach-dmz-server,2,2,2,2,,,,
2015,evalu webvpn ssl vpn featur 1921 router establish vpn connect anyconnect access local intranet access internet find out happend packet meant internet send webvpn configur gigabitethernet00 lan interfac ip nat insid sourc static tcp 1921681001 5443 94140xxyy 5443 extend webvpn gateway websslgateway ip interfac gigabitethernet00 port 5443 ssl trustpoint tpselfsigned4050442324 inservic webvpn context ascalsslvpn secondarycolor 990000 titlecolor black aaa authent list sslvpn gateway websslgateway maxus 10 ssl authent verifi inservic polici group sslvpnpolici function svcenabl svc addresspool vpnpool netmask 2552552550 svc rekey method newtunnel maskurl defaultgrouppolici sslvpnpolici thank in advanc kind reagrd herman,WEBVPN (IOS) cannot access internet,https://supportforums.cisco.com/discussion/12453751/webvpn-ios-cannot-access-internet,2,2,2,2,,,,
2015,asa 5515x router 8818 devic configur site site vpn asa new devic router exist devic in differ locat contain sever work tunnel tunnel up ping local network site asa firewal time tunnel end asa disappear wherea still show router end asa config show runningconfig save asa version 91 2 hostnam citgroup enabl password v9whcfd3zaeul5lr encrypt name interfac gigabitethernet00 nameif outsid securitylevel 0 ip address aaaa 0000 interfac gigabitethernet01 nameif insid securitylevel 100 ip address bbbb 0000 interfac gigabitethernet02 shutdown nameif securitylevel ip address interfac gigabitethernet03 shutdown nameif securitylevel ip address interfac gigabitethernet04 shutdown nameif securitylevel ip address interfac gigabitethernet05 shutdown nameif securitylevel ip address interfac management00 managementonli nameif manag securitylevel 100 ip address 19216811 2552552550 boot system disk0 asa912smpk8bin ftp mode passiv object network objani subnet 0000 0000 accesslist offic extend permit ip asa local ip router local ip accesslist outsidein extend permit tcp eq ssh accesslist outsidein extend permit tcp host asa local ip eq ssh accesslist outsidein extend permit icmp accesslist outsidein extend permit tcp host router local ip host asa local ip eq ssh pager line 24 log asdm inform mtu outsid 1500 mtu insid 1500 mtu manag 1500 failov icmp unreach ratelimit 1 burstsiz 1 asdm imag disk0 asdm713bin asdm histori enabl arp timeout 14400 arp permitnonconnect object network objani nat insid outsid dynam interfac rout outsid 0000 0000 dddd 1 timeout xlate 30000 timeout patxlat 00030 timeout conn 10000 halfclos 01000 udp 00200 icmp 00002 timeout sunrpc 01000 h323 00500 h225 10000 mgcp 00500 mgcppat 00500 timeout sip 03000 sipmedia 00200 sipinvit 00300 sipdisconnect 00200 timeout sipprovisionalmedia 00200 uauth 00500 absolut timeout tcpproxyreassembl 00100 timeout floatingconn 00000 dynamicaccesspolicyrecord dfltaccesspolici userident defaultdomain local aaa authent ssh consol local http server enabl http 19216810 2552552550 manag snmpserver locat snmpserver contact snmpserver enabl trap snmp authent linkup linkdown coldstart warmstart ipsec ikev1 transformset test espaes256 espshahmac ipsec securityassoci pmtuag infinit map outsidemap 1 match address offic map outsidemap 1 set peer kkkk map outsidemap 1 set ikev1 transformset test map outsidemap interfac outsid ca trustpool polici ikev1 enabl outsid ikev1 polici 1 authent preshar encrypt 3de hash sha group 2 lifetim 86400 ikev1 polici 2 authent preshar encrypt 3de hash md5 group 2 lifetim 28800 telnet timeout 5 ssh 0000 0000 outsid ssh 0000 0000 insid ssh timeout 5 ssh keyexchang group dhgroup1sha1 consol timeout 0 dhcpd address 192168121921681254 manag dhcpd enabl manag threatdetect basicthreat threatdetect statist accesslist threatdetect statist tcpintercept usernam admin password jtduvwnnmzvejpfj encrypt usernam nairtim password fyp1bjjsayu55viz encrypt tunnelgroup kkkk type ipsecl2l tunnelgroup kkkk ipsecattribut ikev1 presharedkey classmap inspectiondefault match defaultinspectiontraff policymap type inspect dn presetdnsmap paramet messagelength maximum client auto messagelength maximum 512 policymap globalpolici class inspectiondefault inspect dn presetdnsmap inspect ftp inspect h323 h225 inspect h323 ra inspect rsh inspect rtsp inspect esmtp inspect sqlnet inspect skinni inspect sunrpc inspect xdmcp inspect sip inspect netbio inspect tftp inspect ipopt inspect icmp servicepolici globalpolici global prompt hostnam context callhom report anonym cryptochecksum e658de2652c6702c61a0cc854a47415f end,cannot access local network from outside in Site 2 Site VPN,https://supportforums.cisco.com/discussion/12457131/cannot-access-local-network-outside-site-2-site-vpn,2,2,2,2,,,,
2015,ok wit end read peopl issu point in time fix never seem work tunnel between 2 locat tunnel work fine ping devic end tunnel get ssh tftp traffic travel across tunnel ping insid port gig01 anyth end tunnel attach config sanit much separ area think import someon look see miss pleas want troubl shoot in product would like get up run abil two devic attach via outsid gig00 port one anoth way simul isp connect nt know would mean anyth code one end asa mirror imag except local remot network object port ip thank youjon code putti log 20150324 075917 sho run save asa version 91 2 hostnam colprivateasa domainnam xxxxxxxxxxxxxxxxxxxcom enabl password xxxxxxxxxxxxxxxx encrypt name interfac gigabitethernet00 nameif outsid securitylevel 0 ip address 202021720 25525500 interfac gigabitethernet01 nameif insid securitylevel 100 ip address 10201 25525500 interfac gigabitethernet02 shutdown nameif securitylevel ip address interfac gigabitethernet03 shutdown nameif securitylevel ip address interfac gigabitethernet04 shutdown nameif securitylevel ip address interfac gigabitethernet05 shutdown nameif securitylevel ip address interfac management00 managementonli nameif manag securitylevel 100 ip address 19216811 2552552550 ftp mode passiv clock timezon est5 clock summertim edt recur dn servergroup defaultdn domainnam xxxxxxxxxxxxxxxxxxxxcom object network netloc subnet 10200 25525500 object network netremoteday subnet 10100 25525500 accesslist outsidedaycryptomap extend permit ip object net local object netremoteday log notif ccesslist outsidedaycryptomap extend permit udp accesslist outsidedaycryptomap extend permit tcp eq ssh accesslist outsidedaycryptomap extend permit udp eq tftp pager line 24 log enabl log asdm inform mtu outsid 1500 mtu insid 1500 mtu manag 1500 failov icmp unreach ratelimit 1 burstsiz 1 asdm histori enabl arp timeout 14400 arp permitnonconnect nat insid outsid sourc static netloc netloc destin static netremoteday netremoteday rout outsid 0000 0000 202021414 1 timeout xlate 30000 timeout patxlat 00030 timeout conn 10000 halfclos 01000 udp 00200 icmp 00002 timeout sunrpc 01000 h323 00500 h225 10000 mgcp 00500 mgcppat 00500 timeout sip 03000 sipmedia 00200 sipinvit 00300 sipdisconnect 00200 timeout sipprovisionalmedia 00200 uauth 00500 absolut timeout tcpproxyreassembl 00100 timeout floatingconn 00000 dynamicaccesspolicyrecord dfltaccesspolici userident defaultdomain local aaa authent ssh consol local http server enabl http 19216810 2552552550 manag http 0000 0000 insid snmpserver locat snmpserver contact snmpserver enabl trap snmp authent linkup linkdown coldstart warmstart ipsec ikev1 transformset esp3desmd5 esp3d espmd5hmac ipsec securityassoci pmtuag infinit map outsidemap 3 match address outsidedaycryptomap map outsidemap 3 set pf group1 map outsidemap 3 set peer 203021420 map outsidemap 3 set ikev1 transformset esp3desmd5 map outsidemap interfac outsid ca trustpool polici ikev1 enabl outsid ikev1 polici 30 authent preshar encrypt 3de hash md5 group 2 lifetim 86400 telnet timeout 5 ssh 0000 0000 insid ssh timeout 10 ssh version 2 ssh keyexchang group dhgroup1sha1 consol timeout 0 dhcpd address 192168121921681254 manag dhcpd enabl manag threatdetect basicthreat threatdetect statist accesslist threatdetect statist tcpintercept usernam jmoot password q3x06c6rhdzcowk encrypt privileg 15 tunnelgroup 203021420 type ipsecl2l tunnelgroup 203021420 ipsecattribut ikev1 presharedkey classmap inspectiondefault match defaultinspectiontraff policymap type inspect dn presetdnsmap paramet messagelength maximum client auto messagelength maximum 512 policymap globalpolici class inspectiondefault inspect dn presetdnsmap inspect ftp inspect h323 h225 inspect h323 ra inspect rsh inspect rtsp inspect esmtp inspect sqlnet inspect skinni inspect sunrpc inspect xdmcp inspect sip inspect netbio inspect tftp inspect ipopt servicepolici globalpolici global prompt hostnam context callhom report anonym cryptochecksum0ac82d88d6aac4cb9a4e0fc9bb308553 end colprivateasa sho run ipsec ikev1 transformset esp3desmd5 esp3d espmd5hmac ipsec securityassoci pmtuag infinit map outsidemap 3 match address outsidedaycryptomap map outsidemap 3 set pf group1 map outsidemap 3 set peer 203021420 map outsidemap 3 set ikev1 transformset esp3desmd5 map outsidemap interfac outsid ca trustpool polici ikev1 enabl outsid ikev1 polici 30 authent preshar encrypt 3de hash md5 group 2 lifetim 86400 colprivateasa sho accesslist accesslist cach acl log flow total 0 deni 0 denyflowmax 4096 alertinterv 300 accesslist outsidedaycryptomap 4 element name hash 0xa630e5b0 accesslist outsidedaycryptomap line 1 extend permit ip object netloc object netremoteday log notif interv 300 hitcnt0 0xe11775c5 accesslist outsidedaycryptomap line 1 extend permit ip 10200 25525500 10100 25525500 log notif interv 300 hitcnt0 0xe11775c5 accesslist outsidedaycryptomap line 2 extend permit udp hitcnt0 0x3fe5f981 accesslist outsidedaycryptomap line 3 extend permit tcp eq ssh hitcnt0 0x9720f0ce accesslist outsidedaycryptomap line 4 extend permit udp eq tftp hitcnt0 0x88058956 colprivateasa sho tunnel colprivateasa sho run tunnelgroup tunnelgroup 203021420 type ipsecl2l tunnelgroup 203021420 ipsecattribut ikev1 presharedkey colprivateasa colprivateasa colprivateasa colprivateasa sho nat manual nat polici section 1 1 insid outsid sourc static netloc netloc destin static netremoteday netremoteday translatehit 0 untranslatehit 0,Cannot get SSH or TFTP to travel accross VPN Tunnel,https://supportforums.cisco.com/discussion/12460006/cannot-get-ssh-or-tftp-travel-accross-vpn-tunnel,2,2,2,2,,,,
2015,tri setup webvpn intern network client connect router cant ping anyth intern network also lost ping between host in intern network ping gateway 1921681620 io version 151 4 m9 ip local pool webvpnpool 192168162212 192168162218 ip nat insid sourc list 1 interfac gigabitethernet00 overload accesslist 1 permit 1921681620 000255 webvpn gateway ciscowebvpngateway ip address xxxx port 1025 ssl encrypt rc4md5 ssl trustpoint mytrustpoint inservic webvpn context ciscowebvpn titl easi vpn ssl authent verifi urllist rewrit acl sslacl permit ip 1921681620 2552552550 1921681620 2552552550 loginmessag secur webvpn polici group webvpnpolici function svcenabl function svcrequir filter tunnel sslacl svc addresspool webvpnpool netmask 2552552550 svc rekey method newtunnel svc split includ 1921681620 2552552550 defaultgrouppolici webvpnpolici aaa authent list sslvpn gateway ciscowebvpngateway maxus 2 inservic,WebVPN cannot access Internal network on 2821,https://supportforums.cisco.com/discussion/12464781/webvpn-cannot-access-internal-network-2821,2,2,2,2,,,,
